job_id,title,career_cluster,company_name,region,city,salary,experience_level,education_required,technical_skills,soft_skills,preferred_traits,work_arrangement,company_size,industry_growth,posting_date,applications_received,job_views,save_rate,job_description
259,School Counselor,Education,Company 259,Australia,Brisbane,255272,Executive,Associate's Degree,"Learning Management Systems, Instructional Design, Assessment, Classroom Management","Critical Thinking, Creativity, Interpersonal Skills","Cautious, Innovative",On-site,Medium (201-1000),Stable Growth,2025-03-29,74,962,0.35,"This is a Executive School Counselor position requiring expertise in Learning Management Systems, Instructional Design, Assessment, Classroom Management. The ideal candidate should have strong Critical Thinking, Creativity, Interpersonal Skills skills and be Cautious, Innovative."
260,Materials Scientist,Science & Research,Company 260,South America,Bogota,78543,Mid-level,Bachelor's Degree,"Scientific Writing, Laboratory Techniques, Python","Interpersonal Skills, Attention to Detail, Teamwork, Problem Solving","Cautious, Task-oriented, Independent",Remote,Large (1000+),Moderate Growth,2025-03-31,349,3141,0.16,"This is a Mid-level Materials Scientist position requiring expertise in Scientific Writing, Laboratory Techniques, Python. The ideal candidate should have strong Interpersonal Skills, Attention to Detail, Teamwork, Problem Solving skills and be Cautious, Task-oriented, Independent."
261,Project Manager,Business,Company 261,South America,Buenos Aires,161030,Director,High School,"Data Analysis, Financial Modeling, Marketing, Project Management, CRM Software, Tableau","Problem Solving, Teamwork, Critical Thinking","Adaptable, Outgoing, Visionary",On-site,Small (51-200),Slow Growth,2025-03-29,438,4818,0.24,"This is a Director Project Manager position requiring expertise in Data Analysis, Financial Modeling, Marketing, Project Management, CRM Software, Tableau. The ideal candidate should have strong Problem Solving, Teamwork, Critical Thinking skills and be Adaptable, Outgoing, Visionary."
262,Environmental Scientist,Science & Research,Company 262,Australia,Brisbane,100359,Mid-level,PhD,"Experimental Design, Data Analysis, Python, MATLAB","Creativity, Work Ethic, Self-Motivation","Risk-taker, People-oriented",On-site,Large (1000+),Emerging Field,2025-03-10,23,345,0.1,"This is a Mid-level Environmental Scientist position requiring expertise in Experimental Design, Data Analysis, Python, MATLAB. The ideal candidate should have strong Creativity, Work Ethic, Self-Motivation skills and be Risk-taker, People-oriented."
263,Environmental Scientist,Science & Research,Company 263,Asia,Shanghai,159560,Manager,Bachelor's Degree,"Scientific Writing, Python, Laboratory Techniques, Experimental Design","Creativity, Time Management, Conflict Resolution","Outgoing, Task-oriented",On-site,Medium (201-1000),Emerging Field,2025-03-25,356,4984,0.39,"This is a Manager Environmental Scientist position requiring expertise in Scientific Writing, Python, Laboratory Techniques, Experimental Design. The ideal candidate should have strong Creativity, Time Management, Conflict Resolution skills and be Outgoing, Task-oriented."
264,Creative Director,Creative Arts,Company 264,Africa,Johannesburg,348015,Executive,PhD,"After Effects, Color Theory, Unity, Illustrator, 3D Modeling, Blender","Negotiation, Self-Motivation","Innovative, Independent, Adaptable",Remote,Enterprise (10000+),Slow Growth,2025-03-14,308,4312,0.18,"This is a Executive Creative Director position requiring expertise in After Effects, Color Theory, Unity, Illustrator, 3D Modeling, Blender. The ideal candidate should have strong Negotiation, Self-Motivation skills and be Innovative, Independent, Adaptable."
265,Special Education Teacher,Education,Company 265,Asia,Seoul,371474,Executive,PhD,"Classroom Management, Educational Technology, Online Course Development, Learning Management Systems, Instructional Design","Attention to Detail, Self-Motivation","Innovative, Risk-taker",Remote,Medium (201-1000),High Growth,2025-03-26,285,2565,0.32,"This is a Executive Special Education Teacher position requiring expertise in Classroom Management, Educational Technology, Online Course Development, Learning Management Systems, Instructional Design. The ideal candidate should have strong Attention to Detail, Self-Motivation skills and be Innovative, Risk-taker."
266,UI/UX Designer,Technology,Company 266,Asia,Singapore,178612,Manager,Certification,"SQL, AWS, React, Kubernetes, Node.js, TensorFlow","Self-Motivation, Adaptability","Innovative, Visionary",Hybrid,Large (1000+),Emerging Field,2025-03-11,304,2736,0.31,"This is a Manager UI/UX Designer position requiring expertise in SQL, AWS, React, Kubernetes, Node.js, TensorFlow. The ideal candidate should have strong Self-Motivation, Adaptability skills and be Innovative, Visionary."
267,Game Developer,Creative Arts,Company 267,South America,Santiago,228482,Director,High School,"Blender, Unreal Engine, 3D Modeling, Typography, Photoshop","Time Management, Communication","Analytical, Task-oriented",Remote,Enterprise (10000+),Moderate Growth,2025-03-12,132,1452,0.35,"This is a Director Game Developer position requiring expertise in Blender, Unreal Engine, 3D Modeling, Typography, Photoshop. The ideal candidate should have strong Time Management, Communication skills and be Analytical, Task-oriented."
268,Education Technology Specialist,Education,Company 268,Europe,Paris,66181,Entry-level,Master's Degree,"Assessment, Curriculum Development, Learning Management Systems, Educational Technology","Teamwork, Leadership, Conflict Resolution","Creative, Risk-taker, Cautious",Remote,Medium (201-1000),Stable Growth,2025-03-31,495,5445,0.19,"This is a Entry-level Education Technology Specialist position requiring expertise in Assessment, Curriculum Development, Learning Management Systems, Educational Technology. The ideal candidate should have strong Teamwork, Leadership, Conflict Resolution skills and be Creative, Risk-taker, Cautious."
269,Audio Engineer,Creative Arts,Company 269,North America,San Francisco,187336,Director,Master's Degree,"UI/UX, Color Theory, After Effects, 3D Modeling, Sketch, Illustrator","Teamwork, Interpersonal Skills, Negotiation","Adaptable, Analytical",Hybrid,Startup (1-50),High Growth,2025-03-11,34,442,0.28,"This is a Director Audio Engineer position requiring expertise in UI/UX, Color Theory, After Effects, 3D Modeling, Sketch, Illustrator. The ideal candidate should have strong Teamwork, Interpersonal Skills, Negotiation skills and be Adaptable, Analytical."
270,Management Consultant,Business,Company 270,Asia,Tokyo,117776,Mid-level,High School,"SQL, Data Analysis, Budgeting","Time Management, Teamwork","Creative, Practical",Remote,Large (1000+),High Growth,2025-04-02,59,590,0.27,"This is a Mid-level Management Consultant position requiring expertise in SQL, Data Analysis, Budgeting. The ideal candidate should have strong Time Management, Teamwork skills and be Creative, Practical."
271,Business Analyst,Business,Company 271,Asia,Seoul,53049,Entry-level,Bachelor's Degree,"Project Management, Budgeting, Business Intelligence","Teamwork, Problem Solving","Detail-oriented, Practical",On-site,Large (1000+),Emerging Field,2025-03-16,452,2260,0.38,"This is a Entry-level Business Analyst position requiring expertise in Project Management, Budgeting, Business Intelligence. The ideal candidate should have strong Teamwork, Problem Solving skills and be Detail-oriented, Practical."
272,DevOps Engineer,Technology,Company 272,Europe,Berlin,176811,Senior,Associate's Degree,"React, AWS, SQL, TensorFlow, PyTorch, Node.js","Time Management, Emotional Intelligence","Collaborative, Creative",Remote,Medium (201-1000),High Growth,2025-04-01,480,3360,0.25,"This is a Senior DevOps Engineer position requiring expertise in React, AWS, SQL, TensorFlow, PyTorch, Node.js. The ideal candidate should have strong Time Management, Emotional Intelligence skills and be Collaborative, Creative."
273,Management Consultant,Business,Company 273,South America,Buenos Aires,167969,Manager,Master's Degree,"Project Management, Marketing, Business Intelligence, Financial Modeling, Data Analysis","Conflict Resolution, Creativity, Communication","People-oriented, Adaptable",On-site,Startup (1-50),Emerging Field,2025-03-23,191,2483,0.11,"This is a Manager Management Consultant position requiring expertise in Project Management, Marketing, Business Intelligence, Financial Modeling, Data Analysis. The ideal candidate should have strong Conflict Resolution, Creativity, Communication skills and be People-oriented, Adaptable."
274,Laboratory Technician,Science & Research,Company 274,Europe,Madrid,93574,Mid-level,PhD,"Scientific Instrumentation, MATLAB, Laboratory Techniques, Research Methods, Experimental Design","Conflict Resolution, Negotiation","People-oriented, Innovative, Detail-oriented",Flexible,Startup (1-50),Slow Growth,2025-03-13,405,4860,0.12,"This is a Mid-level Laboratory Technician position requiring expertise in Scientific Instrumentation, MATLAB, Laboratory Techniques, Research Methods, Experimental Design. The ideal candidate should have strong Conflict Resolution, Negotiation skills and be People-oriented, Innovative, Detail-oriented."
275,Physical Therapist,Healthcare,Company 275,Asia,Shanghai,177666,Manager,Certification,"Healthcare Regulations, Laboratory Techniques, Medical Software, Biology, Patient Care","Critical Thinking, Attention to Detail, Teamwork","Organized, Detail-oriented",On-site,Small (51-200),Slow Growth,2025-03-08,123,1353,0.32,"This is a Manager Physical Therapist position requiring expertise in Healthcare Regulations, Laboratory Techniques, Medical Software, Biology, Patient Care. The ideal candidate should have strong Critical Thinking, Attention to Detail, Teamwork skills and be Organized, Detail-oriented."
276,Laboratory Technician,Science & Research,Company 276,Asia,Tokyo,65718,Entry-level,High School,"Research Methods, Laboratory Techniques, Python, MATLAB, Experimental Design","Adaptability, Creativity, Conflict Resolution","Organized, Adaptable, Innovative",Flexible,Large (1000+),High Growth,2025-03-11,19,133,0.16,"This is a Entry-level Laboratory Technician position requiring expertise in Research Methods, Laboratory Techniques, Python, MATLAB, Experimental Design. The ideal candidate should have strong Adaptability, Creativity, Conflict Resolution skills and be Organized, Adaptable, Innovative."
277,Cloud Architect,Technology,Company 277,Europe,Berlin,52547,Entry-level,Master's Degree,"AWS, Docker, JavaScript, Kubernetes, C++","Negotiation, Self-Motivation, Critical Thinking, Emotional Intelligence","Innovative, Outgoing, Cautious",On-site,Medium (201-1000),High Growth,2025-03-06,170,1700,0.07,"This is a Entry-level Cloud Architect position requiring expertise in AWS, Docker, JavaScript, Kubernetes, C++. The ideal candidate should have strong Negotiation, Self-Motivation, Critical Thinking, Emotional Intelligence skills and be Innovative, Outgoing, Cautious."
278,Education Technology Specialist,Education,Company 278,Australia,Sydney,185140,Manager,Associate's Degree,"Online Course Development, Educational Technology, Assessment, Curriculum Development, Instructional Design, Learning Management Systems","Communication, Problem Solving","Analytical, Organized, Practical",Flexible,Enterprise (10000+),High Growth,2025-03-13,146,1314,0.24,"This is a Manager Education Technology Specialist position requiring expertise in Online Course Development, Educational Technology, Assessment, Curriculum Development, Instructional Design, Learning Management Systems. The ideal candidate should have strong Communication, Problem Solving skills and be Analytical, Organized, Practical."
279,Laboratory Technician,Science & Research,Company 279,Asia,Dubai,127624,Manager,Certification,"Experimental Design, Scientific Instrumentation, R, MATLAB","Critical Thinking, Leadership","Innovative, Risk-taker, Adaptable",Flexible,Medium (201-1000),Stable Growth,2025-03-14,398,4378,0.08,"This is a Manager Laboratory Technician position requiring expertise in Experimental Design, Scientific Instrumentation, R, MATLAB. The ideal candidate should have strong Critical Thinking, Leadership skills and be Innovative, Risk-taker, Adaptable."
280,Healthcare Administrator,Healthcare,Company 280,Asia,Tokyo,232610,Director,Associate's Degree,"Biology, Medical Software, Clinical Assessment, Patient Care, Electronic Health Records, Laboratory Techniques","Leadership, Time Management, Critical Thinking, Conflict Resolution","Collaborative, Outgoing, Risk-taker",On-site,Startup (1-50),Moderate Growth,2025-03-13,51,357,0.23,"This is a Director Healthcare Administrator position requiring expertise in Biology, Medical Software, Clinical Assessment, Patient Care, Electronic Health Records, Laboratory Techniques. The ideal candidate should have strong Leadership, Time Management, Critical Thinking, Conflict Resolution skills and be Collaborative, Outgoing, Risk-taker."
281,Physical Therapist,Healthcare,Company 281,Asia,Shanghai,72555,Entry-level,PhD,"Laboratory Techniques, Medical Terminology, Electronic Health Records, Clinical Assessment","Problem Solving, Self-Motivation, Conflict Resolution","Collaborative, Creative, People-oriented",On-site,Small (51-200),Moderate Growth,2025-03-26,140,840,0.17,"This is a Entry-level Physical Therapist position requiring expertise in Laboratory Techniques, Medical Terminology, Electronic Health Records, Clinical Assessment. The ideal candidate should have strong Problem Solving, Self-Motivation, Conflict Resolution skills and be Collaborative, Creative, People-oriented."
282,Teacher,Education,Company 282,Europe,Dublin,138333,Senior,PhD,"Educational Technology, Online Course Development, Classroom Management, Learning Management Systems","Teamwork, Adaptability","Visionary, Innovative",On-site,Startup (1-50),High Growth,2025-03-08,89,712,0.13,"This is a Senior Teacher position requiring expertise in Educational Technology, Online Course Development, Classroom Management, Learning Management Systems. The ideal candidate should have strong Teamwork, Adaptability skills and be Visionary, Innovative."
283,Environmental Scientist,Science & Research,Company 283,North America,Seattle,318658,Executive,Associate's Degree,"Scientific Writing, R, Scientific Instrumentation, MATLAB","Attention to Detail, Problem Solving, Conflict Resolution, Emotional Intelligence","Innovative, People-oriented",Hybrid,Medium (201-1000),High Growth,2025-03-24,300,4200,0.31,"This is a Executive Environmental Scientist position requiring expertise in Scientific Writing, R, Scientific Instrumentation, MATLAB. The ideal candidate should have strong Attention to Detail, Problem Solving, Conflict Resolution, Emotional Intelligence skills and be Innovative, People-oriented."
284,Product Manager,Business,Company 284,South America,Buenos Aires,141006,Senior,Associate's Degree,"Data Analysis, Project Management, Tableau, CRM Software, Marketing","Teamwork, Adaptability, Self-Motivation","Task-oriented, People-oriented",Hybrid,Startup (1-50),Slow Growth,2025-04-03,188,1880,0.38,"This is a Senior Product Manager position requiring expertise in Data Analysis, Project Management, Tableau, CRM Software, Marketing. The ideal candidate should have strong Teamwork, Adaptability, Self-Motivation skills and be Task-oriented, People-oriented."
285,Physicist,Science & Research,Company 285,North America,Austin,68765,Entry-level,PhD,"R, Python, Research Methods, Scientific Writing","Interpersonal Skills, Problem Solving, Attention to Detail, Time Management","People-oriented, Innovative, Cautious",On-site,Enterprise (10000+),Slow Growth,2025-03-22,192,1920,0.34,"This is a Entry-level Physicist position requiring expertise in R, Python, Research Methods, Scientific Writing. The ideal candidate should have strong Interpersonal Skills, Problem Solving, Attention to Detail, Time Management skills and be People-oriented, Innovative, Cautious."
286,Special Education Teacher,Education,Company 286,Europe,Berlin,148950,Manager,High School,"Classroom Management, Learning Management Systems, Online Course Development","Critical Thinking, Conflict Resolution","Collaborative, Visionary, Analytical",Remote,Small (51-200),High Growth,2025-03-23,462,6006,0.1,"This is a Manager Special Education Teacher position requiring expertise in Classroom Management, Learning Management Systems, Online Course Development. The ideal candidate should have strong Critical Thinking, Conflict Resolution skills and be Collaborative, Visionary, Analytical."
287,Environmental Scientist,Science & Research,Company 287,Europe,Paris,139788,Manager,Master's Degree,"R, MATLAB, Statistical Analysis","Work Ethic, Conflict Resolution","Creative, Risk-taker, Analytical",Hybrid,Medium (201-1000),Emerging Field,2025-03-18,15,150,0.14,"This is a Manager Environmental Scientist position requiring expertise in R, MATLAB, Statistical Analysis. The ideal candidate should have strong Work Ethic, Conflict Resolution skills and be Creative, Risk-taker, Analytical."
288,Operations Manager,Business,Company 288,Europe,Madrid,167296,Manager,Bachelor's Degree,"Marketing, Budgeting, Tableau, PowerBI","Conflict Resolution, Communication","Innovative, Independent",Flexible,Startup (1-50),Moderate Growth,2025-03-23,20,200,0.08,"This is a Manager Operations Manager position requiring expertise in Marketing, Budgeting, Tableau, PowerBI. The ideal candidate should have strong Conflict Resolution, Communication skills and be Innovative, Independent."
289,Human Resources Manager,Business,Company 289,Africa,Cairo,69656,Entry-level,Master's Degree,"SQL, Microsoft Excel, PowerBI, Business Intelligence, Marketing","Critical Thinking, Teamwork","Methodical, People-oriented",Remote,Medium (201-1000),Moderate Growth,2025-03-28,457,6855,0.4,"This is a Entry-level Human Resources Manager position requiring expertise in SQL, Microsoft Excel, PowerBI, Business Intelligence, Marketing. The ideal candidate should have strong Critical Thinking, Teamwork skills and be Methodical, People-oriented."
290,Medical Researcher,Healthcare,Company 290,Australia,Sydney,124287,Manager,Bachelor's Degree,"Chemistry, Biology, Electronic Health Records, Healthcare Regulations, Patient Care","Emotional Intelligence, Problem Solving, Negotiation, Critical Thinking","Creative, Practical, Collaborative",Flexible,Large (1000+),Moderate Growth,2025-03-24,358,3580,0.38,"This is a Manager Medical Researcher position requiring expertise in Chemistry, Biology, Electronic Health Records, Healthcare Regulations, Patient Care. The ideal candidate should have strong Emotional Intelligence, Problem Solving, Negotiation, Critical Thinking skills and be Creative, Practical, Collaborative."
291,Physical Therapist,Healthcare,Company 291,South America,Bogota,380809,Executive,Bachelor's Degree,"Healthcare Regulations, Medical Terminology, Electronic Health Records, Clinical Assessment, Chemistry","Conflict Resolution, Work Ethic, Emotional Intelligence, Critical Thinking","Task-oriented, Cautious, Collaborative",Flexible,Medium (201-1000),Moderate Growth,2025-03-19,308,1540,0.12,"This is a Executive Physical Therapist position requiring expertise in Healthcare Regulations, Medical Terminology, Electronic Health Records, Clinical Assessment, Chemistry. The ideal candidate should have strong Conflict Resolution, Work Ethic, Emotional Intelligence, Critical Thinking skills and be Task-oriented, Cautious, Collaborative."
292,Machine Learning Engineer,Technology,Company 292,Europe,Paris,43966,Entry-level,High School,"Git, Node.js, Docker","Time Management, Interpersonal Skills, Self-Motivation","Outgoing, Task-oriented, Analytical",Hybrid,Startup (1-50),Moderate Growth,2025-03-19,19,171,0.06,"This is a Entry-level Machine Learning Engineer position requiring expertise in Git, Node.js, Docker. The ideal candidate should have strong Time Management, Interpersonal Skills, Self-Motivation skills and be Outgoing, Task-oriented, Analytical."
293,Curriculum Developer,Education,Company 293,Europe,Madrid,187898,Manager,Certification,"Assessment, Educational Technology, Curriculum Development, Classroom Management","Time Management, Work Ethic","Task-oriented, People-oriented",Hybrid,Enterprise (10000+),High Growth,2025-03-18,97,873,0.05,"This is a Manager Curriculum Developer position requiring expertise in Assessment, Educational Technology, Curriculum Development, Classroom Management. The ideal candidate should have strong Time Management, Work Ethic skills and be Task-oriented, People-oriented."
294,Biologist,Science & Research,Company 294,Europe,Berlin,145503,Manager,Certification,"Research Methods, Laboratory Techniques, R, Experimental Design, Scientific Writing, Data Analysis","Negotiation, Self-Motivation, Communication","Methodical, Adaptable",On-site,Enterprise (10000+),Emerging Field,2025-04-02,11,66,0.32,"This is a Manager Biologist position requiring expertise in Research Methods, Laboratory Techniques, R, Experimental Design, Scientific Writing, Data Analysis. The ideal candidate should have strong Negotiation, Self-Motivation, Communication skills and be Methodical, Adaptable."
295,Operations Manager,Business,Company 295,Europe,Madrid,163555,Senior,High School,"Microsoft Excel, Budgeting, PowerBI, Financial Modeling","Communication, Critical Thinking","Methodical, Practical",Remote,Startup (1-50),Moderate Growth,2025-03-30,143,1287,0.18,"This is a Senior Operations Manager position requiring expertise in Microsoft Excel, Budgeting, PowerBI, Financial Modeling. The ideal candidate should have strong Communication, Critical Thinking skills and be Methodical, Practical."
296,Research Scientist,Science & Research,Company 296,North America,Seattle,188363,Director,PhD,"Scientific Instrumentation, Research Methods, Python","Critical Thinking, Self-Motivation, Negotiation, Problem Solving","Independent, People-oriented, Task-oriented",Hybrid,Small (51-200),Stable Growth,2025-03-23,170,2210,0.12,"This is a Director Research Scientist position requiring expertise in Scientific Instrumentation, Research Methods, Python. The ideal candidate should have strong Critical Thinking, Self-Motivation, Negotiation, Problem Solving skills and be Independent, People-oriented, Task-oriented."
297,Astrophysicist,Science & Research,Company 297,Asia,Tokyo,54830,Entry-level,Certification,"Scientific Writing, Python, Statistical Analysis, Research Methods, Scientific Instrumentation","Problem Solving, Conflict Resolution, Leadership, Time Management","Practical, Methodical, Visionary",Remote,Startup (1-50),Emerging Field,2025-03-12,429,3432,0.25,"This is a Entry-level Astrophysicist position requiring expertise in Scientific Writing, Python, Statistical Analysis, Research Methods, Scientific Instrumentation. The ideal candidate should have strong Problem Solving, Conflict Resolution, Leadership, Time Management skills and be Practical, Methodical, Visionary."
298,Data Scientist,Technology,Company 298,Asia,Tokyo,193085,Director,Master's Degree,"SQL, Java, C++, Node.js, JavaScript, Python","Attention to Detail, Creativity, Work Ethic, Conflict Resolution","Cautious, Methodical, Independent",Hybrid,Medium (201-1000),Stable Growth,2025-03-22,478,4302,0.1,"This is a Director Data Scientist position requiring expertise in SQL, Java, C++, Node.js, JavaScript, Python. The ideal candidate should have strong Attention to Detail, Creativity, Work Ethic, Conflict Resolution skills and be Cautious, Methodical, Independent."
299,Cloud Architect,Technology,Company 299,Australia,Adelaide,112105,Mid-level,Bachelor's Degree,"Docker, Kubernetes, Cloud Computing, C++","Leadership, Teamwork, Communication","Independent, Innovative",Flexible,Enterprise (10000+),Slow Growth,2025-03-29,226,1582,0.2,"This is a Mid-level Cloud Architect position requiring expertise in Docker, Kubernetes, Cloud Computing, C++. The ideal candidate should have strong Leadership, Teamwork, Communication skills and be Independent, Innovative."
300,Data Scientist,Technology,Company 300,South America,Santiago,178337,Director,Certification,"C++, CI/CD, JavaScript, Kubernetes, Cloud Computing, TensorFlow","Conflict Resolution, Emotional Intelligence, Adaptability","Outgoing, Detail-oriented",Flexible,Large (1000+),Stable Growth,2025-03-27,39,507,0.08,"This is a Director Data Scientist position requiring expertise in C++, CI/CD, JavaScript, Kubernetes, Cloud Computing, TensorFlow. The ideal candidate should have strong Conflict Resolution, Emotional Intelligence, Adaptability skills and be Outgoing, Detail-oriented."
301,Medical Researcher,Healthcare,Company 301,Asia,Tokyo,87445,Mid-level,Master's Degree,"Laboratory Techniques, Medical Software, Clinical Assessment, Biology","Problem Solving, Creativity","Creative, Cautious, Detail-oriented",Flexible,Startup (1-50),Moderate Growth,2025-03-29,66,990,0.38,"This is a Mid-level Medical Researcher position requiring expertise in Laboratory Techniques, Medical Software, Clinical Assessment, Biology. The ideal candidate should have strong Problem Solving, Creativity skills and be Creative, Cautious, Detail-oriented."
302,Data Scientist,Technology,Company 302,Australia,Melbourne,320625,Executive,Master's Degree,"TensorFlow, React, CI/CD, Cloud Computing, AWS, Machine Learning","Creativity, Emotional Intelligence, Critical Thinking, Work Ethic","Cautious, Detail-oriented",Remote,Medium (201-1000),Stable Growth,2025-03-27,227,1589,0.39,"This is a Executive Data Scientist position requiring expertise in TensorFlow, React, CI/CD, Cloud Computing, AWS, Machine Learning. The ideal candidate should have strong Creativity, Emotional Intelligence, Critical Thinking, Work Ethic skills and be Cautious, Detail-oriented."
