job_id,title,career_cluster,company_name,region,city,salary,experience_level,education_required,technical_skills,soft_skills,preferred_traits,work_arrangement,company_size,industry_growth,posting_date,applications_received,job_views,save_rate,job_description
519,Chemist,Science & Research,Company 519,Europe,London,163804,Manager,Bachelor's Degree,"Scientific Instrumentation, Statistical Analysis, Data Analysis, Research Methods, R, Laboratory Techniques","Emotional Intelligence, Adaptability, Work Ethic, Creativity","Risk-taker, Detail-oriented",On-site,Startup (1-50),Stable Growth,2025-03-15,342,5130,0.31,"This is a Manager Chemist position requiring expertise in Scientific Instrumentation, Statistical Analysis, Data Analysis, Research Methods, R, Laboratory Techniques. The ideal candidate should have strong Emotional Intelligence, Adaptability, Work Ethic, Creativity skills and be Risk-taker, Detail-oriented."
520,Creative Director,Creative Arts,Company 520,North America,Austin,52865,Entry-level,PhD,"Unity, Color Theory, Photoshop, Illustrator, After Effects","Self-Motivation, Time Management, Conflict Resolution, Negotiation","Risk-taker, Practical, Adaptable",Remote,Enterprise (10000+),Emerging Field,2025-03-14,391,3910,0.32,"This is a Entry-level Creative Director position requiring expertise in Unity, Color Theory, Photoshop, Illustrator, After Effects. The ideal candidate should have strong Self-Motivation, Time Management, Conflict Resolution, Negotiation skills and be Risk-taker, Practical, Adaptable."
521,UI/UX Designer,Technology,Company 521,Australia,Perth,91853,Mid-level,Associate's Degree,"Cloud Computing, Java, AWS","Negotiation, Teamwork","Methodical, Visionary",Flexible,Small (51-200),High Growth,2025-03-27,215,3225,0.21,"This is a Mid-level UI/UX Designer position requiring expertise in Cloud Computing, Java, AWS. The ideal candidate should have strong Negotiation, Teamwork skills and be Methodical, Visionary."
522,Digital Artist,Creative Arts,Company 522,North America,Austin,369711,Executive,High School,"Photoshop, 3D Modeling, Color Theory","Work Ethic, Interpersonal Skills, Adaptability, Emotional Intelligence","Organized, Detail-oriented",Hybrid,Enterprise (10000+),Slow Growth,2025-03-18,124,1116,0.08,"This is a Executive Digital Artist position requiring expertise in Photoshop, 3D Modeling, Color Theory. The ideal candidate should have strong Work Ethic, Interpersonal Skills, Adaptability, Emotional Intelligence skills and be Organized, Detail-oriented."
523,Teacher,Education,Company 523,South America,Santiago,48023,Entry-level,Bachelor's Degree,"Curriculum Development, Online Course Development, Instructional Design, Assessment","Negotiation, Adaptability","Cautious, Collaborative",Remote,Medium (201-1000),Slow Growth,2025-04-01,478,4780,0.33,"This is a Entry-level Teacher position requiring expertise in Curriculum Development, Online Course Development, Instructional Design, Assessment. The ideal candidate should have strong Negotiation, Adaptability skills and be Cautious, Collaborative."
524,Audio Engineer,Creative Arts,Company 524,South America,Sao Paulo,52157,Entry-level,Master's Degree,"Sketch, Unreal Engine, Photoshop","Teamwork, Conflict Resolution","Detail-oriented, Practical",Remote,Medium (201-1000),Emerging Field,2025-04-04,90,810,0.33,"This is a Entry-level Audio Engineer position requiring expertise in Sketch, Unreal Engine, Photoshop. The ideal candidate should have strong Teamwork, Conflict Resolution skills and be Detail-oriented, Practical."
525,Game Developer,Creative Arts,Company 525,North America,Toronto,163369,Director,High School,"3D Modeling, After Effects, Illustrator","Critical Thinking, Emotional Intelligence, Communication, Conflict Resolution","Practical, Creative, Cautious",Flexible,Large (1000+),Stable Growth,2025-03-15,284,4260,0.2,"This is a Director Game Developer position requiring expertise in 3D Modeling, After Effects, Illustrator. The ideal candidate should have strong Critical Thinking, Emotional Intelligence, Communication, Conflict Resolution skills and be Practical, Creative, Cautious."
526,DevOps Engineer,Technology,Company 526,Europe,Paris,94955,Mid-level,Certification,"Kubernetes, TensorFlow, Cloud Computing, Docker","Negotiation, Teamwork, Work Ethic, Creativity","Organized, Outgoing, Task-oriented",Hybrid,Large (1000+),Stable Growth,2025-03-21,491,3437,0.4,"This is a Mid-level DevOps Engineer position requiring expertise in Kubernetes, TensorFlow, Cloud Computing, Docker. The ideal candidate should have strong Negotiation, Teamwork, Work Ethic, Creativity skills and be Organized, Outgoing, Task-oriented."
527,Education Technology Specialist,Education,Company 527,Asia,Seoul,171146,Director,Certification,"Classroom Management, Curriculum Development, Assessment","Self-Motivation, Communication, Work Ethic, Leadership","Methodical, Task-oriented",Remote,Small (51-200),Stable Growth,2025-03-18,498,4482,0.29,"This is a Director Education Technology Specialist position requiring expertise in Classroom Management, Curriculum Development, Assessment. The ideal candidate should have strong Self-Motivation, Communication, Work Ethic, Leadership skills and be Methodical, Task-oriented."
528,Curriculum Developer,Education,Company 528,Asia,Seoul,180202,Director,PhD,"Classroom Management, Educational Technology, Online Course Development, Instructional Design, Curriculum Development, Learning Management Systems","Emotional Intelligence, Attention to Detail, Self-Motivation","Collaborative, Analytical",Hybrid,Large (1000+),High Growth,2025-03-18,50,550,0.05,"This is a Director Curriculum Developer position requiring expertise in Classroom Management, Educational Technology, Online Course Development, Instructional Design, Curriculum Development, Learning Management Systems. The ideal candidate should have strong Emotional Intelligence, Attention to Detail, Self-Motivation skills and be Collaborative, Analytical."
529,Video Editor,Creative Arts,Company 529,South America,Buenos Aires,110263,Mid-level,PhD,"UI/UX, Color Theory, Typography, 3D Modeling, Sketch","Self-Motivation, Interpersonal Skills, Work Ethic","Organized, Task-oriented, Practical",Remote,Large (1000+),Moderate Growth,2025-03-18,404,4444,0.27,"This is a Mid-level Video Editor position requiring expertise in UI/UX, Color Theory, Typography, 3D Modeling, Sketch. The ideal candidate should have strong Self-Motivation, Interpersonal Skills, Work Ethic skills and be Organized, Task-oriented, Practical."
530,Physician,Healthcare,Company 530,Australia,Brisbane,176217,Director,PhD,"Healthcare Regulations, Electronic Health Records, Biology, Clinical Assessment","Interpersonal Skills, Communication, Self-Motivation","Creative, Organized",Remote,Enterprise (10000+),Moderate Growth,2025-03-11,303,3030,0.24,"This is a Director Physician position requiring expertise in Healthcare Regulations, Electronic Health Records, Biology, Clinical Assessment. The ideal candidate should have strong Interpersonal Skills, Communication, Self-Motivation skills and be Creative, Organized."
531,Research Scientist,Science & Research,Company 531,Europe,Paris,94164,Mid-level,Bachelor's Degree,"Scientific Writing, R, Statistical Analysis, Research Methods, Scientific Instrumentation","Self-Motivation, Communication, Time Management","Cautious, Risk-taker, Independent",Hybrid,Enterprise (10000+),Emerging Field,2025-04-03,323,2907,0.26,"This is a Mid-level Research Scientist position requiring expertise in Scientific Writing, R, Statistical Analysis, Research Methods, Scientific Instrumentation. The ideal candidate should have strong Self-Motivation, Communication, Time Management skills and be Cautious, Risk-taker, Independent."
532,Operations Manager,Business,Company 532,Europe,Berlin,151385,Director,PhD,"Budgeting, SQL, Data Analysis","Communication, Problem Solving, Negotiation, Self-Motivation","Cautious, Outgoing, Risk-taker",Hybrid,Large (1000+),Stable Growth,2025-03-15,483,2415,0.09,"This is a Director Operations Manager position requiring expertise in Budgeting, SQL, Data Analysis. The ideal candidate should have strong Communication, Problem Solving, Negotiation, Self-Motivation skills and be Cautious, Outgoing, Risk-taker."
533,Creative Director,Creative Arts,Company 533,South America,Lima,76064,Entry-level,PhD,"UI/UX, Color Theory, Typography, Illustrator","Leadership, Self-Motivation, Interpersonal Skills","Innovative, Outgoing, Collaborative",Remote,Medium (201-1000),Slow Growth,2025-03-18,478,2390,0.09,"This is a Entry-level Creative Director position requiring expertise in UI/UX, Color Theory, Typography, Illustrator. The ideal candidate should have strong Leadership, Self-Motivation, Interpersonal Skills skills and be Innovative, Outgoing, Collaborative."
534,Business Analyst,Business,Company 534,North America,Seattle,186226,Manager,Associate's Degree,"Google Analytics, Business Intelligence, Project Management, Financial Modeling","Work Ethic, Problem Solving, Conflict Resolution, Creativity","Cautious, Creative",Remote,Large (1000+),High Growth,2025-03-08,16,224,0.36,"This is a Manager Business Analyst position requiring expertise in Google Analytics, Business Intelligence, Project Management, Financial Modeling. The ideal candidate should have strong Work Ethic, Problem Solving, Conflict Resolution, Creativity skills and be Cautious, Creative."
535,School Counselor,Education,Company 535,North America,Austin,164776,Director,Master's Degree,"Curriculum Development, Assessment, Educational Technology, Learning Management Systems, Classroom Management","Adaptability, Self-Motivation, Time Management, Emotional Intelligence","Adaptable, Innovative",Hybrid,Small (51-200),High Growth,2025-04-02,187,2431,0.29,"This is a Director School Counselor position requiring expertise in Curriculum Development, Assessment, Educational Technology, Learning Management Systems, Classroom Management. The ideal candidate should have strong Adaptability, Self-Motivation, Time Management, Emotional Intelligence skills and be Adaptable, Innovative."
536,Chemist,Science & Research,Company 536,Europe,Dublin,76179,Entry-level,Bachelor's Degree,"R, Experimental Design, Research Methods, Scientific Writing, Laboratory Techniques","Leadership, Work Ethic, Self-Motivation, Communication","Innovative, Visionary, Outgoing",On-site,Enterprise (10000+),Moderate Growth,2025-03-29,168,1008,0.35,"This is a Entry-level Chemist position requiring expertise in R, Experimental Design, Research Methods, Scientific Writing, Laboratory Techniques. The ideal candidate should have strong Leadership, Work Ethic, Self-Motivation, Communication skills and be Innovative, Visionary, Outgoing."
537,Digital Artist,Creative Arts,Company 537,North America,San Francisco,137886,Manager,High School,"After Effects, UI/UX, Color Theory, 3D Modeling","Work Ethic, Attention to Detail, Negotiation, Time Management","Collaborative, Creative",Hybrid,Startup (1-50),Moderate Growth,2025-03-24,318,4452,0.17,"This is a Manager Digital Artist position requiring expertise in After Effects, UI/UX, Color Theory, 3D Modeling. The ideal candidate should have strong Work Ethic, Attention to Detail, Negotiation, Time Management skills and be Collaborative, Creative."
538,Education Technology Specialist,Education,Company 538,South America,Lima,151485,Director,Associate's Degree,"Classroom Management, Curriculum Development, Learning Management Systems, Instructional Design, Online Course Development","Communication, Leadership, Conflict Resolution","Practical, Methodical",Remote,Startup (1-50),Stable Growth,2025-03-25,499,4990,0.3,"This is a Director Education Technology Specialist position requiring expertise in Classroom Management, Curriculum Development, Learning Management Systems, Instructional Design, Online Course Development. The ideal candidate should have strong Communication, Leadership, Conflict Resolution skills and be Practical, Methodical."
539,Graphic Designer,Creative Arts,Company 539,Europe,Amsterdam,159522,Manager,Certification,"Adobe Creative Suite, Sketch, 3D Modeling, Color Theory","Negotiation, Time Management, Leadership","Creative, Adaptable",On-site,Startup (1-50),Slow Growth,2025-03-24,215,2580,0.18,"This is a Manager Graphic Designer position requiring expertise in Adobe Creative Suite, Sketch, 3D Modeling, Color Theory. The ideal candidate should have strong Negotiation, Time Management, Leadership skills and be Creative, Adaptable."
540,Graphic Designer,Creative Arts,Company 540,South America,Bogota,189279,Manager,PhD,"Photoshop, 3D Modeling, Color Theory, After Effects, Illustrator","Time Management, Negotiation, Conflict Resolution","Visionary, Outgoing",Hybrid,Large (1000+),Emerging Field,2025-03-17,147,882,0.11,"This is a Manager Graphic Designer position requiring expertise in Photoshop, 3D Modeling, Color Theory, After Effects, Illustrator. The ideal candidate should have strong Time Management, Negotiation, Conflict Resolution skills and be Visionary, Outgoing."
541,Teacher,Education,Company 541,Australia,Perth,136074,Manager,Master's Degree,"Assessment, Classroom Management, Educational Technology, Learning Management Systems, Curriculum Development","Attention to Detail, Adaptability","Analytical, Organized",Flexible,Startup (1-50),Moderate Growth,2025-03-10,220,2640,0.07,"This is a Manager Teacher position requiring expertise in Assessment, Classroom Management, Educational Technology, Learning Management Systems, Curriculum Development. The ideal candidate should have strong Attention to Detail, Adaptability skills and be Analytical, Organized."
542,Academic Advisor,Education,Company 542,North America,Austin,124480,Senior,Bachelor's Degree,"Curriculum Development, Educational Technology, Assessment, Learning Management Systems, Instructional Design, Online Course Development","Problem Solving, Communication, Negotiation","Cautious, Analytical",Flexible,Startup (1-50),Stable Growth,2025-03-22,362,3982,0.07,"This is a Senior Academic Advisor position requiring expertise in Curriculum Development, Educational Technology, Assessment, Learning Management Systems, Instructional Design, Online Course Development. The ideal candidate should have strong Problem Solving, Communication, Negotiation skills and be Cautious, Analytical."
543,Management Consultant,Business,Company 543,South America,Buenos Aires,155777,Director,PhD,"PowerBI, Marketing, Google Analytics, Financial Modeling, SQL","Creativity, Self-Motivation","Innovative, Cautious, Outgoing",Remote,Medium (201-1000),Slow Growth,2025-04-03,140,1400,0.39,"This is a Director Management Consultant position requiring expertise in PowerBI, Marketing, Google Analytics, Financial Modeling, SQL. The ideal candidate should have strong Creativity, Self-Motivation skills and be Innovative, Cautious, Outgoing."
544,Astrophysicist,Science & Research,Company 544,Asia,Tokyo,160077,Manager,Master's Degree,"Data Analysis, R, Experimental Design, Scientific Instrumentation","Interpersonal Skills, Self-Motivation, Time Management","Task-oriented, Practical, Detail-oriented",On-site,Startup (1-50),Slow Growth,2025-03-12,79,1027,0.28,"This is a Manager Astrophysicist position requiring expertise in Data Analysis, R, Experimental Design, Scientific Instrumentation. The ideal candidate should have strong Interpersonal Skills, Self-Motivation, Time Management skills and be Task-oriented, Practical, Detail-oriented."
545,Creative Director,Creative Arts,Company 545,Australia,Brisbane,196564,Director,Associate's Degree,"Typography, Adobe Creative Suite, 3D Modeling","Work Ethic, Interpersonal Skills","Practical, Cautious",Flexible,Small (51-200),Moderate Growth,2025-03-09,459,5967,0.12,"This is a Director Creative Director position requiring expertise in Typography, Adobe Creative Suite, 3D Modeling. The ideal candidate should have strong Work Ethic, Interpersonal Skills skills and be Practical, Cautious."
546,Teacher,Education,Company 546,North America,Chicago,161964,Manager,Bachelor's Degree,"Online Course Development, Educational Technology, Classroom Management, Assessment, Curriculum Development","Interpersonal Skills, Time Management, Attention to Detail","Collaborative, Task-oriented",Flexible,Large (1000+),Slow Growth,2025-03-09,198,2772,0.16,"This is a Manager Teacher position requiring expertise in Online Course Development, Educational Technology, Classroom Management, Assessment, Curriculum Development. The ideal candidate should have strong Interpersonal Skills, Time Management, Attention to Detail skills and be Collaborative, Task-oriented."
547,Operations Manager,Business,Company 547,Africa,Cape Town,281645,Executive,Master's Degree,"SQL, PowerBI, Google Analytics, Marketing","Leadership, Conflict Resolution","Detail-oriented, Collaborative",On-site,Medium (201-1000),Slow Growth,2025-04-02,304,1520,0.38,"This is a Executive Operations Manager position requiring expertise in SQL, PowerBI, Google Analytics, Marketing. The ideal candidate should have strong Leadership, Conflict Resolution skills and be Detail-oriented, Collaborative."
548,Operations Manager,Business,Company 548,Australia,Brisbane,173196,Director,Bachelor's Degree,"Data Analysis, Tableau, Microsoft Excel, Budgeting","Critical Thinking, Negotiation, Teamwork","Innovative, Practical, Outgoing",On-site,Startup (1-50),Moderate Growth,2025-04-04,287,4305,0.1,"This is a Director Operations Manager position requiring expertise in Data Analysis, Tableau, Microsoft Excel, Budgeting. The ideal candidate should have strong Critical Thinking, Negotiation, Teamwork skills and be Innovative, Practical, Outgoing."
549,Research Scientist,Science & Research,Company 549,Europe,Paris,73608,Entry-level,Master's Degree,"Scientific Instrumentation, MATLAB, Python, Research Methods","Conflict Resolution, Communication","People-oriented, Creative, Adaptable",Hybrid,Large (1000+),High Growth,2025-03-18,17,204,0.14,"This is a Entry-level Research Scientist position requiring expertise in Scientific Instrumentation, MATLAB, Python, Research Methods. The ideal candidate should have strong Conflict Resolution, Communication skills and be People-oriented, Creative, Adaptable."
550,Machine Learning Engineer,Technology,Company 550,Asia,Shanghai,128235,Senior,High School,"Git, PyTorch, Kubernetes, C++, Cloud Computing","Negotiation, Work Ethic, Creativity","Methodical, Creative",On-site,Startup (1-50),High Growth,2025-03-21,393,4323,0.22,"This is a Senior Machine Learning Engineer position requiring expertise in Git, PyTorch, Kubernetes, C++, Cloud Computing. The ideal candidate should have strong Negotiation, Work Ethic, Creativity skills and be Methodical, Creative."
551,Academic Advisor,Education,Company 551,Africa,Cairo,122398,Manager,Bachelor's Degree,"Classroom Management, Instructional Design, Assessment","Attention to Detail, Self-Motivation","People-oriented, Methodical",Remote,Medium (201-1000),Stable Growth,2025-03-31,344,3784,0.32,"This is a Manager Academic Advisor position requiring expertise in Classroom Management, Instructional Design, Assessment. The ideal candidate should have strong Attention to Detail, Self-Motivation skills and be People-oriented, Methodical."
552,Biomedical Engineer,Healthcare,Company 552,Asia,Seoul,393383,Executive,PhD,"Chemistry, Electronic Health Records, Medical Software, Patient Care","Communication, Time Management, Self-Motivation, Teamwork","Creative, Outgoing",On-site,Small (51-200),High Growth,2025-04-04,15,195,0.18,"This is a Executive Biomedical Engineer position requiring expertise in Chemistry, Electronic Health Records, Medical Software, Patient Care. The ideal candidate should have strong Communication, Time Management, Self-Motivation, Teamwork skills and be Creative, Outgoing."
553,Data Scientist,Technology,Company 553,Africa,Johannesburg,106690,Senior,Associate's Degree,"SQL, Cloud Computing, AWS, JavaScript","Work Ethic, Critical Thinking","Organized, Independent, Visionary",Flexible,Medium (201-1000),High Growth,2025-03-21,178,1780,0.06,"This is a Senior Data Scientist position requiring expertise in SQL, Cloud Computing, AWS, JavaScript. The ideal candidate should have strong Work Ethic, Critical Thinking skills and be Organized, Independent, Visionary."
554,Pharmacist,Healthcare,Company 554,Europe,Dublin,152475,Senior,Bachelor's Degree,"Clinical Assessment, Healthcare Regulations, Patient Care, Medical Software","Emotional Intelligence, Work Ethic, Attention to Detail","Collaborative, Creative, People-oriented",Hybrid,Enterprise (10000+),High Growth,2025-03-15,353,4589,0.2,"This is a Senior Pharmacist position requiring expertise in Clinical Assessment, Healthcare Regulations, Patient Care, Medical Software. The ideal candidate should have strong Emotional Intelligence, Work Ethic, Attention to Detail skills and be Collaborative, Creative, People-oriented."
555,School Counselor,Education,Company 555,Australia,Brisbane,190038,Director,High School,"Assessment, Curriculum Development, Educational Technology","Self-Motivation, Work Ethic, Time Management","Analytical, Adaptable",Flexible,Small (51-200),Moderate Growth,2025-03-24,244,2196,0.05,"This is a Director School Counselor position requiring expertise in Assessment, Curriculum Development, Educational Technology. The ideal candidate should have strong Self-Motivation, Work Ethic, Time Management skills and be Analytical, Adaptable."
556,Cloud Architect,Technology,Company 556,Europe,Berlin,219816,Executive,High School,"CI/CD, SQL, Git","Critical Thinking, Conflict Resolution","Risk-taker, Analytical",Hybrid,Enterprise (10000+),Moderate Growth,2025-03-22,285,1710,0.25,"This is a Executive Cloud Architect position requiring expertise in CI/CD, SQL, Git. The ideal candidate should have strong Critical Thinking, Conflict Resolution skills and be Risk-taker, Analytical."
557,Registered Nurse,Healthcare,Company 557,Asia,Tokyo,362900,Executive,High School,"Laboratory Techniques, Medical Terminology, Clinical Assessment, Patient Care, Chemistry","Creativity, Work Ethic","Innovative, Task-oriented, Cautious",Flexible,Startup (1-50),Emerging Field,2025-03-09,471,4710,0.2,"This is a Executive Registered Nurse position requiring expertise in Laboratory Techniques, Medical Terminology, Clinical Assessment, Patient Care, Chemistry. The ideal candidate should have strong Creativity, Work Ethic skills and be Innovative, Task-oriented, Cautious."
558,Content Creator,Creative Arts,Company 558,Australia,Melbourne,244732,Director,Bachelor's Degree,"Unity, Adobe Creative Suite, Color Theory, Sketch, 3D Modeling, Photoshop","Critical Thinking, Teamwork, Problem Solving","Visionary, Adaptable, Creative",Hybrid,Startup (1-50),Emerging Field,2025-03-23,135,675,0.15,"This is a Director Content Creator position requiring expertise in Unity, Adobe Creative Suite, Color Theory, Sketch, 3D Modeling, Photoshop. The ideal candidate should have strong Critical Thinking, Teamwork, Problem Solving skills and be Visionary, Adaptable, Creative."
559,Machine Learning Engineer,Technology,Company 559,Europe,London,134034,Manager,PhD,"TensorFlow, Cloud Computing, PyTorch, Git","Time Management, Self-Motivation, Teamwork, Critical Thinking","Outgoing, Adaptable",Remote,Small (51-200),Moderate Growth,2025-03-15,300,4500,0.23,"This is a Manager Machine Learning Engineer position requiring expertise in TensorFlow, Cloud Computing, PyTorch, Git. The ideal candidate should have strong Time Management, Self-Motivation, Teamwork, Critical Thinking skills and be Outgoing, Adaptable."
560,Digital Artist,Creative Arts,Company 560,Africa,Cairo,132394,Manager,Master's Degree,"3D Modeling, Unity, Adobe Creative Suite, UI/UX, Sketch, After Effects","Leadership, Conflict Resolution, Interpersonal Skills","Task-oriented, Independent, Practical",Hybrid,Enterprise (10000+),Emerging Field,2025-03-30,67,737,0.13,"This is a Manager Digital Artist position requiring expertise in 3D Modeling, Unity, Adobe Creative Suite, UI/UX, Sketch, After Effects. The ideal candidate should have strong Leadership, Conflict Resolution, Interpersonal Skills skills and be Task-oriented, Independent, Practical."
561,Operations Manager,Business,Company 561,North America,Seattle,40040,Entry-level,Master's Degree,"PowerBI, CRM Software, Microsoft Excel, Budgeting, Tableau","Teamwork, Self-Motivation, Adaptability, Time Management","Cautious, People-oriented",On-site,Startup (1-50),Moderate Growth,2025-03-23,237,2133,0.2,"This is a Entry-level Operations Manager position requiring expertise in PowerBI, CRM Software, Microsoft Excel, Budgeting, Tableau. The ideal candidate should have strong Teamwork, Self-Motivation, Adaptability, Time Management skills and be Cautious, People-oriented."
562,Graphic Designer,Creative Arts,Company 562,South America,Lima,197597,Director,Bachelor's Degree,"Illustrator, 3D Modeling, UI/UX, Adobe Creative Suite, Sketch","Self-Motivation, Emotional Intelligence, Work Ethic","Detail-oriented, People-oriented",On-site,Startup (1-50),Stable Growth,2025-03-21,111,1221,0.22,"This is a Director Graphic Designer position requiring expertise in Illustrator, 3D Modeling, UI/UX, Adobe Creative Suite, Sketch. The ideal candidate should have strong Self-Motivation, Emotional Intelligence, Work Ethic skills and be Detail-oriented, People-oriented."
