job_id,title,career_cluster,company_name,region,city,salary,experience_level,education_required,technical_skills,soft_skills,preferred_traits,work_arrangement,company_size,industry_growth,posting_date,applications_received,job_views,save_rate,job_description
735,Astrophysicist,Science & Research,Company 735,Australia,Melbourne,350929,Executive,PhD,"Scientific Writing, Laboratory Techniques, Research Methods, Scientific Instrumentation, Data Analysis","Attention to Detail, Emotional Intelligence, Self-Motivation, Critical Thinking","Risk-taker, Visionary, Methodical",Hybrid,Medium (201-1000),Emerging Field,2025-04-02,410,5330,0.2,"This is a Executive Astrophysicist position requiring expertise in Scientific Writing, Laboratory Techniques, Research Methods, Scientific Instrumentation, Data Analysis. The ideal candidate should have strong Attention to Detail, Emotional Intelligence, Self-Motivation, Critical Thinking skills and be Risk-taker, Visionary, Methodical."
736,Astrophysicist,Science & Research,Company 736,Africa,Johannesburg,138436,Manager,Associate's Degree,"Laboratory Techniques, Scientific Instrumentation, Scientific Writing, R, Data Analysis, Python","Work Ethic, Adaptability, Attention to Detail, Creativity","Creative, Methodical, Analytical",On-site,Small (51-200),Slow Growth,2025-03-17,241,2892,0.17,"This is a Manager Astrophysicist position requiring expertise in Laboratory Techniques, Scientific Instrumentation, Scientific Writing, R, Data Analysis, Python. The ideal candidate should have strong Work Ethic, Adaptability, Attention to Detail, Creativity skills and be Creative, Methodical, Analytical."
737,Physicist,Science & Research,Company 737,North America,Austin,156379,Senior,High School,"Data Analysis, Statistical Analysis, R, Scientific Writing","Self-Motivation, Creativity","Collaborative, Outgoing, Practical",Flexible,Large (1000+),Stable Growth,2025-03-13,103,618,0.1,"This is a Senior Physicist position requiring expertise in Data Analysis, Statistical Analysis, R, Scientific Writing. The ideal candidate should have strong Self-Motivation, Creativity skills and be Collaborative, Outgoing, Practical."
738,Chemist,Science & Research,Company 738,North America,San Francisco,163642,Director,Master's Degree,"Scientific Instrumentation, Data Analysis, Research Methods, R, Experimental Design","Creativity, Emotional Intelligence, Negotiation","Innovative, Risk-taker",Hybrid,Enterprise (10000+),Emerging Field,2025-03-22,118,1416,0.32,"This is a Director Chemist position requiring expertise in Scientific Instrumentation, Data Analysis, Research Methods, R, Experimental Design. The ideal candidate should have strong Creativity, Emotional Intelligence, Negotiation skills and be Innovative, Risk-taker."
739,Chemist,Science & Research,Company 739,South America,Lima,135582,Manager,PhD,"Statistical Analysis, R, Research Methods, Scientific Writing","Adaptability, Attention to Detail, Critical Thinking","Organized, Outgoing, Collaborative",Hybrid,Startup (1-50),Slow Growth,2025-03-19,454,5902,0.34,"This is a Manager Chemist position requiring expertise in Statistical Analysis, R, Research Methods, Scientific Writing. The ideal candidate should have strong Adaptability, Attention to Detail, Critical Thinking skills and be Organized, Outgoing, Collaborative."
740,Human Resources Manager,Business,Company 740,Africa,Johannesburg,49297,Entry-level,Associate's Degree,"Tableau, PowerBI, Project Management","Problem Solving, Interpersonal Skills, Creativity","Creative, Detail-oriented, Risk-taker",Flexible,Large (1000+),Moderate Growth,2025-03-18,311,1866,0.19,"This is a Entry-level Human Resources Manager position requiring expertise in Tableau, PowerBI, Project Management. The ideal candidate should have strong Problem Solving, Interpersonal Skills, Creativity skills and be Creative, Detail-oriented, Risk-taker."
741,Registered Nurse,Healthcare,Company 741,Africa,Nairobi,153987,Director,Certification,"Chemistry, Medical Terminology, Clinical Assessment, Patient Care","Leadership, Communication","Adaptable, Practical, Outgoing",Remote,Enterprise (10000+),High Growth,2025-03-07,238,1666,0.24,"This is a Director Registered Nurse position requiring expertise in Chemistry, Medical Terminology, Clinical Assessment, Patient Care. The ideal candidate should have strong Leadership, Communication skills and be Adaptable, Practical, Outgoing."
742,Teacher,Education,Company 742,Australia,Sydney,242213,Director,PhD,"Online Course Development, Classroom Management, Educational Technology, Curriculum Development, Instructional Design, Learning Management Systems","Conflict Resolution, Teamwork, Interpersonal Skills","Organized, Adaptable",On-site,Small (51-200),Slow Growth,2025-03-26,23,161,0.13,"This is a Director Teacher position requiring expertise in Online Course Development, Classroom Management, Educational Technology, Curriculum Development, Instructional Design, Learning Management Systems. The ideal candidate should have strong Conflict Resolution, Teamwork, Interpersonal Skills skills and be Organized, Adaptable."
743,Laboratory Technician,Science & Research,Company 743,Africa,Cairo,118424,Senior,Associate's Degree,"Scientific Writing, Laboratory Techniques, Research Methods, Scientific Instrumentation, MATLAB, Statistical Analysis","Negotiation, Communication","Organized, Innovative, Creative",Flexible,Startup (1-50),High Growth,2025-03-10,279,2232,0.28,"This is a Senior Laboratory Technician position requiring expertise in Scientific Writing, Laboratory Techniques, Research Methods, Scientific Instrumentation, MATLAB, Statistical Analysis. The ideal candidate should have strong Negotiation, Communication skills and be Organized, Innovative, Creative."
744,Chemist,Science & Research,Company 744,Australia,Perth,240875,Director,Master's Degree,"Python, Statistical Analysis, Laboratory Techniques","Leadership, Problem Solving","Adaptable, People-oriented, Cautious",Remote,Enterprise (10000+),Stable Growth,2025-03-28,368,4416,0.23,"This is a Director Chemist position requiring expertise in Python, Statistical Analysis, Laboratory Techniques. The ideal candidate should have strong Leadership, Problem Solving skills and be Adaptable, People-oriented, Cautious."
745,DevOps Engineer,Technology,Company 745,Africa,Johannesburg,137530,Senior,PhD,"Kubernetes, TensorFlow, JavaScript, SQL","Time Management, Attention to Detail","Task-oriented, Cautious, Collaborative",Remote,Medium (201-1000),Moderate Growth,2025-03-07,396,3960,0.16,"This is a Senior DevOps Engineer position requiring expertise in Kubernetes, TensorFlow, JavaScript, SQL. The ideal candidate should have strong Time Management, Attention to Detail skills and be Task-oriented, Cautious, Collaborative."
746,Project Manager,Business,Company 746,Africa,Cape Town,269284,Executive,PhD,"Data Analysis, PowerBI, Financial Modeling, Google Analytics, SQL, CRM Software","Conflict Resolution, Negotiation","Collaborative, Risk-taker, Adaptable",Flexible,Medium (201-1000),High Growth,2025-03-06,254,2286,0.36,"This is a Executive Project Manager position requiring expertise in Data Analysis, PowerBI, Financial Modeling, Google Analytics, SQL, CRM Software. The ideal candidate should have strong Conflict Resolution, Negotiation skills and be Collaborative, Risk-taker, Adaptable."
747,Instructional Designer,Education,Company 747,Australia,Brisbane,259845,Executive,PhD,"Curriculum Development, Learning Management Systems, Assessment, Instructional Design, Classroom Management","Conflict Resolution, Teamwork, Critical Thinking, Problem Solving","Independent, Collaborative",Hybrid,Large (1000+),Emerging Field,2025-03-30,457,3656,0.33,"This is a Executive Instructional Designer position requiring expertise in Curriculum Development, Learning Management Systems, Assessment, Instructional Design, Classroom Management. The ideal candidate should have strong Conflict Resolution, Teamwork, Critical Thinking, Problem Solving skills and be Independent, Collaborative."
748,Pharmacist,Healthcare,Company 748,Asia,Seoul,95960,Mid-level,High School,"Healthcare Regulations, Medical Software, Medical Terminology, Clinical Assessment","Interpersonal Skills, Critical Thinking, Leadership","Analytical, People-oriented",Hybrid,Startup (1-50),Slow Growth,2025-03-13,131,655,0.16,"This is a Mid-level Pharmacist position requiring expertise in Healthcare Regulations, Medical Software, Medical Terminology, Clinical Assessment. The ideal candidate should have strong Interpersonal Skills, Critical Thinking, Leadership skills and be Analytical, People-oriented."
749,DevOps Engineer,Technology,Company 749,Asia,Singapore,166032,Director,Master's Degree,"Python, AWS, Node.js","Attention to Detail, Interpersonal Skills, Time Management","Creative, Innovative",Remote,Startup (1-50),Moderate Growth,2025-03-10,12,180,0.29,"This is a Director DevOps Engineer position requiring expertise in Python, AWS, Node.js. The ideal candidate should have strong Attention to Detail, Interpersonal Skills, Time Management skills and be Creative, Innovative."
750,Graphic Designer,Creative Arts,Company 750,South America,Lima,117866,Senior,High School,"Typography, 3D Modeling, Blender, Sketch, Photoshop","Attention to Detail, Time Management, Self-Motivation","Methodical, Creative",Flexible,Small (51-200),Stable Growth,2025-03-20,499,2495,0.14,"This is a Senior Graphic Designer position requiring expertise in Typography, 3D Modeling, Blender, Sketch, Photoshop. The ideal candidate should have strong Attention to Detail, Time Management, Self-Motivation skills and be Methodical, Creative."
751,Physicist,Science & Research,Company 751,North America,Toronto,74172,Mid-level,Associate's Degree,"Data Analysis, Scientific Writing, Python, MATLAB, Research Methods, Experimental Design","Interpersonal Skills, Negotiation, Communication, Self-Motivation","Adaptable, Innovative",On-site,Enterprise (10000+),Moderate Growth,2025-03-30,232,1856,0.15,"This is a Mid-level Physicist position requiring expertise in Data Analysis, Scientific Writing, Python, MATLAB, Research Methods, Experimental Design. The ideal candidate should have strong Interpersonal Skills, Negotiation, Communication, Self-Motivation skills and be Adaptable, Innovative."
752,Software Engineer,Technology,Company 752,Europe,Madrid,206493,Director,Bachelor's Degree,"C++, CI/CD, Java","Work Ethic, Interpersonal Skills","Creative, Practical, Detail-oriented",Remote,Startup (1-50),High Growth,2025-03-22,473,5676,0.15,"This is a Director Software Engineer position requiring expertise in C++, CI/CD, Java. The ideal candidate should have strong Work Ethic, Interpersonal Skills skills and be Creative, Practical, Detail-oriented."
753,Astrophysicist,Science & Research,Company 753,North America,Seattle,129657,Senior,Master's Degree,"Experimental Design, Scientific Writing, Scientific Instrumentation, Laboratory Techniques, Python, R","Conflict Resolution, Leadership","Task-oriented, Collaborative",On-site,Small (51-200),Moderate Growth,2025-03-12,199,1791,0.14,"This is a Senior Astrophysicist position requiring expertise in Experimental Design, Scientific Writing, Scientific Instrumentation, Laboratory Techniques, Python, R. The ideal candidate should have strong Conflict Resolution, Leadership skills and be Task-oriented, Collaborative."
754,Biologist,Science & Research,Company 754,Asia,Bangalore,151578,Senior,High School,"Statistical Analysis, Experimental Design, Laboratory Techniques, Scientific Instrumentation","Time Management, Attention to Detail, Critical Thinking, Negotiation","Practical, Outgoing, Adaptable",Remote,Medium (201-1000),Moderate Growth,2025-03-24,24,312,0.2,"This is a Senior Biologist position requiring expertise in Statistical Analysis, Experimental Design, Laboratory Techniques, Scientific Instrumentation. The ideal candidate should have strong Time Management, Attention to Detail, Critical Thinking, Negotiation skills and be Practical, Outgoing, Adaptable."
755,Registered Nurse,Healthcare,Company 755,North America,San Francisco,67303,Entry-level,High School,"Medical Terminology, Healthcare Regulations, Patient Care, Biology, Clinical Assessment, Electronic Health Records","Emotional Intelligence, Teamwork, Interpersonal Skills, Work Ethic","Collaborative, Analytical",Hybrid,Enterprise (10000+),High Growth,2025-03-16,499,3493,0.36,"This is a Entry-level Registered Nurse position requiring expertise in Medical Terminology, Healthcare Regulations, Patient Care, Biology, Clinical Assessment, Electronic Health Records. The ideal candidate should have strong Emotional Intelligence, Teamwork, Interpersonal Skills, Work Ethic skills and be Collaborative, Analytical."
756,Physical Therapist,Healthcare,Company 756,Europe,Dublin,104629,Mid-level,Master's Degree,"Healthcare Regulations, Medical Software, Medical Terminology","Conflict Resolution, Negotiation, Time Management, Critical Thinking","Independent, Task-oriented, Methodical",Remote,Medium (201-1000),High Growth,2025-04-03,313,1878,0.08,"This is a Mid-level Physical Therapist position requiring expertise in Healthcare Regulations, Medical Software, Medical Terminology. The ideal candidate should have strong Conflict Resolution, Negotiation, Time Management, Critical Thinking skills and be Independent, Task-oriented, Methodical."
757,Instructional Designer,Education,Company 757,Europe,Amsterdam,83860,Mid-level,PhD,"Instructional Design, Educational Technology, Learning Management Systems, Curriculum Development, Classroom Management","Conflict Resolution, Leadership, Communication, Interpersonal Skills","Innovative, Outgoing, Adaptable",Remote,Startup (1-50),Emerging Field,2025-03-21,285,2565,0.1,"This is a Mid-level Instructional Designer position requiring expertise in Instructional Design, Educational Technology, Learning Management Systems, Curriculum Development, Classroom Management. The ideal candidate should have strong Conflict Resolution, Leadership, Communication, Interpersonal Skills skills and be Innovative, Outgoing, Adaptable."
758,Human Resources Manager,Business,Company 758,South America,Buenos Aires,123232,Manager,Master's Degree,"SQL, Project Management, CRM Software, Microsoft Excel","Negotiation, Conflict Resolution","Task-oriented, Visionary",Flexible,Large (1000+),Slow Growth,2025-03-09,62,372,0.39,"This is a Manager Human Resources Manager position requiring expertise in SQL, Project Management, CRM Software, Microsoft Excel. The ideal candidate should have strong Negotiation, Conflict Resolution skills and be Task-oriented, Visionary."
759,Human Resources Manager,Business,Company 759,South America,Sao Paulo,124443,Senior,Master's Degree,"Financial Modeling, PowerBI, Microsoft Excel, Data Analysis, Project Management, Google Analytics","Attention to Detail, Interpersonal Skills, Self-Motivation, Adaptability","Methodical, Analytical",On-site,Enterprise (10000+),High Growth,2025-04-04,461,6915,0.2,"This is a Senior Human Resources Manager position requiring expertise in Financial Modeling, PowerBI, Microsoft Excel, Data Analysis, Project Management, Google Analytics. The ideal candidate should have strong Attention to Detail, Interpersonal Skills, Self-Motivation, Adaptability skills and be Methodical, Analytical."
760,Medical Researcher,Healthcare,Company 760,Africa,Nairobi,139333,Manager,Bachelor's Degree,"Biology, Medical Software, Medical Terminology, Patient Care, Laboratory Techniques, Clinical Assessment","Attention to Detail, Interpersonal Skills, Adaptability","Detail-oriented, Visionary, Task-oriented",On-site,Startup (1-50),Stable Growth,2025-03-16,68,408,0.32,"This is a Manager Medical Researcher position requiring expertise in Biology, Medical Software, Medical Terminology, Patient Care, Laboratory Techniques, Clinical Assessment. The ideal candidate should have strong Attention to Detail, Interpersonal Skills, Adaptability skills and be Detail-oriented, Visionary, Task-oriented."
761,Registered Nurse,Healthcare,Company 761,Africa,Nairobi,187852,Manager,Bachelor's Degree,"Biology, Laboratory Techniques, Chemistry, Medical Terminology, Medical Software, Healthcare Regulations","Critical Thinking, Time Management, Leadership, Communication","Practical, Detail-oriented",Flexible,Small (51-200),Moderate Growth,2025-03-13,50,700,0.28,"This is a Manager Registered Nurse position requiring expertise in Biology, Laboratory Techniques, Chemistry, Medical Terminology, Medical Software, Healthcare Regulations. The ideal candidate should have strong Critical Thinking, Time Management, Leadership, Communication skills and be Practical, Detail-oriented."
762,Marketing Manager,Business,Company 762,Asia,Seoul,162308,Senior,Associate's Degree,"PowerBI, Google Analytics, Budgeting","Critical Thinking, Emotional Intelligence","Detail-oriented, Outgoing",Remote,Large (1000+),High Growth,2025-03-12,79,1106,0.17,"This is a Senior Marketing Manager position requiring expertise in PowerBI, Google Analytics, Budgeting. The ideal candidate should have strong Critical Thinking, Emotional Intelligence skills and be Detail-oriented, Outgoing."
763,Management Consultant,Business,Company 763,South America,Sao Paulo,194335,Manager,High School,"Budgeting, Microsoft Excel, SQL, Financial Modeling, Business Intelligence, Google Analytics","Attention to Detail, Interpersonal Skills, Conflict Resolution","Practical, Innovative, People-oriented",Flexible,Large (1000+),High Growth,2025-04-02,212,2968,0.07,"This is a Manager Management Consultant position requiring expertise in Budgeting, Microsoft Excel, SQL, Financial Modeling, Business Intelligence, Google Analytics. The ideal candidate should have strong Attention to Detail, Interpersonal Skills, Conflict Resolution skills and be Practical, Innovative, People-oriented."
764,Physical Therapist,Healthcare,Company 764,Africa,Lagos,235220,Director,High School,"Clinical Assessment, Chemistry, Healthcare Regulations, Laboratory Techniques","Teamwork, Emotional Intelligence, Leadership","Outgoing, Creative, Innovative",On-site,Medium (201-1000),Emerging Field,2025-03-26,468,7020,0.29,"This is a Director Physical Therapist position requiring expertise in Clinical Assessment, Chemistry, Healthcare Regulations, Laboratory Techniques. The ideal candidate should have strong Teamwork, Emotional Intelligence, Leadership skills and be Outgoing, Creative, Innovative."
765,Product Manager,Business,Company 765,Asia,Dubai,286025,Executive,Associate's Degree,"Marketing, SQL, PowerBI, Project Management, Tableau, Google Analytics","Leadership, Communication, Conflict Resolution","Task-oriented, Collaborative, Innovative",Flexible,Medium (201-1000),Emerging Field,2025-04-03,420,4200,0.37,"This is a Executive Product Manager position requiring expertise in Marketing, SQL, PowerBI, Project Management, Tableau, Google Analytics. The ideal candidate should have strong Leadership, Communication, Conflict Resolution skills and be Task-oriented, Collaborative, Innovative."
766,Materials Scientist,Science & Research,Company 766,Africa,Cape Town,75584,Entry-level,Master's Degree,"Laboratory Techniques, Python, Scientific Writing, Statistical Analysis, MATLAB, Scientific Instrumentation","Interpersonal Skills, Attention to Detail, Communication, Time Management","Innovative, Organized",Flexible,Medium (201-1000),Moderate Growth,2025-03-24,232,3480,0.15,"This is a Entry-level Materials Scientist position requiring expertise in Laboratory Techniques, Python, Scientific Writing, Statistical Analysis, MATLAB, Scientific Instrumentation. The ideal candidate should have strong Interpersonal Skills, Attention to Detail, Communication, Time Management skills and be Innovative, Organized."
767,Special Education Teacher,Education,Company 767,South America,Bogota,112547,Senior,Associate's Degree,"Assessment, Curriculum Development, Educational Technology","Interpersonal Skills, Negotiation","Creative, Organized, Adaptable",Flexible,Medium (201-1000),High Growth,2025-03-25,337,4044,0.23,"This is a Senior Special Education Teacher position requiring expertise in Assessment, Curriculum Development, Educational Technology. The ideal candidate should have strong Interpersonal Skills, Negotiation skills and be Creative, Organized, Adaptable."
768,Biologist,Science & Research,Company 768,Africa,Johannesburg,76307,Entry-level,Certification,"Experimental Design, Python, MATLAB, Scientific Instrumentation, Scientific Writing, Research Methods","Time Management, Attention to Detail, Emotional Intelligence, Communication","Practical, Creative, Organized",On-site,Medium (201-1000),Moderate Growth,2025-03-15,459,2754,0.32,"This is a Entry-level Biologist position requiring expertise in Experimental Design, Python, MATLAB, Scientific Instrumentation, Scientific Writing, Research Methods. The ideal candidate should have strong Time Management, Attention to Detail, Emotional Intelligence, Communication skills and be Practical, Creative, Organized."
769,Instructional Designer,Education,Company 769,North America,Seattle,101520,Mid-level,High School,"Educational Technology, Learning Management Systems, Curriculum Development, Assessment","Self-Motivation, Critical Thinking","Detail-oriented, Cautious, Methodical",Hybrid,Enterprise (10000+),Moderate Growth,2025-03-08,442,5304,0.23,"This is a Mid-level Instructional Designer position requiring expertise in Educational Technology, Learning Management Systems, Curriculum Development, Assessment. The ideal candidate should have strong Self-Motivation, Critical Thinking skills and be Detail-oriented, Cautious, Methodical."
770,Registered Nurse,Healthcare,Company 770,Europe,Madrid,151286,Manager,Associate's Degree,"Laboratory Techniques, Biology, Chemistry, Clinical Assessment, Medical Terminology, Healthcare Regulations","Creativity, Conflict Resolution","Independent, Task-oriented",Remote,Medium (201-1000),Moderate Growth,2025-03-14,334,3674,0.11,"This is a Manager Registered Nurse position requiring expertise in Laboratory Techniques, Biology, Chemistry, Clinical Assessment, Medical Terminology, Healthcare Regulations. The ideal candidate should have strong Creativity, Conflict Resolution skills and be Independent, Task-oriented."
771,Research Scientist,Science & Research,Company 771,Asia,Tokyo,216698,Director,Bachelor's Degree,"Scientific Instrumentation, R, Laboratory Techniques","Adaptability, Communication","Methodical, Outgoing, Practical",Flexible,Large (1000+),Moderate Growth,2025-03-29,252,2520,0.36,"This is a Director Research Scientist position requiring expertise in Scientific Instrumentation, R, Laboratory Techniques. The ideal candidate should have strong Adaptability, Communication skills and be Methodical, Outgoing, Practical."
772,Physician,Healthcare,Company 772,South America,Bogota,337902,Executive,Bachelor's Degree,"Electronic Health Records, Healthcare Regulations, Laboratory Techniques, Medical Software","Self-Motivation, Work Ethic","Adaptable, Organized, Visionary",Flexible,Large (1000+),Emerging Field,2025-04-03,136,1632,0.07,"This is a Executive Physician position requiring expertise in Electronic Health Records, Healthcare Regulations, Laboratory Techniques, Medical Software. The ideal candidate should have strong Self-Motivation, Work Ethic skills and be Adaptable, Organized, Visionary."
773,Game Developer,Creative Arts,Company 773,North America,Austin,101329,Mid-level,High School,"Photoshop, Typography, Unity, Adobe Creative Suite, 3D Modeling","Self-Motivation, Critical Thinking, Negotiation, Problem Solving","Adaptable, Cautious, People-oriented",On-site,Small (51-200),High Growth,2025-03-25,182,1456,0.23,"This is a Mid-level Game Developer position requiring expertise in Photoshop, Typography, Unity, Adobe Creative Suite, 3D Modeling. The ideal candidate should have strong Self-Motivation, Critical Thinking, Negotiation, Problem Solving skills and be Adaptable, Cautious, People-oriented."
774,Academic Advisor,Education,Company 774,Europe,Berlin,301492,Executive,Certification,"Instructional Design, Online Course Development, Curriculum Development, Educational Technology, Assessment, Learning Management Systems","Interpersonal Skills, Critical Thinking","Innovative, Practical",Flexible,Small (51-200),Slow Growth,2025-03-17,379,2274,0.1,"This is a Executive Academic Advisor position requiring expertise in Instructional Design, Online Course Development, Curriculum Development, Educational Technology, Assessment, Learning Management Systems. The ideal candidate should have strong Interpersonal Skills, Critical Thinking skills and be Innovative, Practical."
775,Audio Engineer,Creative Arts,Company 775,Europe,Dublin,76503,Mid-level,Bachelor's Degree,"After Effects, UI/UX, Unity, Adobe Creative Suite","Emotional Intelligence, Problem Solving, Critical Thinking","Adaptable, Creative, Detail-oriented",On-site,Small (51-200),Emerging Field,2025-03-13,97,873,0.37,"This is a Mid-level Audio Engineer position requiring expertise in After Effects, UI/UX, Unity, Adobe Creative Suite. The ideal candidate should have strong Emotional Intelligence, Problem Solving, Critical Thinking skills and be Adaptable, Creative, Detail-oriented."
776,Software Engineer,Technology,Company 776,South America,Santiago,97429,Mid-level,Associate's Degree,"Java, SQL, Kubernetes","Adaptability, Attention to Detail","People-oriented, Organized, Visionary",Flexible,Medium (201-1000),Moderate Growth,2025-03-30,365,2920,0.1,"This is a Mid-level Software Engineer position requiring expertise in Java, SQL, Kubernetes. The ideal candidate should have strong Adaptability, Attention to Detail skills and be People-oriented, Organized, Visionary."
