job_id,title,career_cluster,company_name,region,city,salary,experience_level,education_required,technical_skills,soft_skills,preferred_traits,work_arrangement,company_size,industry_growth,posting_date,applications_received,job_views,save_rate,job_description
1,Pharmacist,Healthcare,Company 1,Australia,Melbourne,141222,Manager,Master's Degree,"Healthcare Regulations, Electronic Health Records, Laboratory Techniques, Medical Terminology, Medical Software, Chemistry","Teamwork, Communication, Leadership","People-oriented, Outgoing, Creative",Hybrid,Enterprise (10000+),Moderate Growth,2025-03-31,194,970,0.32,"This is a Manager Pharmacist position requiring expertise in Healthcare Regulations, Electronic Health Records, Laboratory Techniques, Medical Terminology, Medical Software, Chemistry. The ideal candidate should have strong Teamwork, Communication, Leadership skills and be People-oriented, Outgoing, Creative."
2,Audio Engineer,Creative Arts,Company 2,Africa,Lagos,132856,Senior,Master's Degree,"Photoshop, UI/UX, Unreal Engine, After Effects, Unity","Work Ethic, Creativity, Attention to Detail, Conflict Resolution","Practical, Task-oriented, Detail-oriented",Remote,Medium (201-1000),Slow Growth,2025-04-03,22,198,0.08,"This is a Senior Audio Engineer position requiring expertise in Photoshop, UI/UX, Unreal Engine, After Effects, Unity. The ideal candidate should have strong Work Ethic, Creativity, Attention to Detail, Conflict Resolution skills and be Practical, Task-oriented, Detail-oriented."
3,Educational Consultant,Education,Company 3,Africa,Lagos,269734,Executive,PhD,"Online Course Development, Instructional Design, Learning Management Systems, Classroom Management, Assessment, Educational Technology","Time Management, Problem Solving","Cautious, Task-oriented",On-site,Startup (1-50),Stable Growth,2025-03-30,420,4200,0.16,"This is a Executive Educational Consultant position requiring expertise in Online Course Development, Instructional Design, Learning Management Systems, Classroom Management, Assessment, Educational Technology. The ideal candidate should have strong Time Management, Problem Solving skills and be Cautious, Task-oriented."
4,Chemist,Science & Research,Company 4,Australia,Brisbane,141302,Senior,Bachelor's Degree,"Research Methods, Laboratory Techniques, Scientific Writing, Data Analysis, R","Self-Motivation, Adaptability, Critical Thinking, Creativity","Detail-oriented, Cautious",Flexible,Enterprise (10000+),High Growth,2025-03-31,126,1134,0.29,"This is a Senior Chemist position requiring expertise in Research Methods, Laboratory Techniques, Scientific Writing, Data Analysis, R. The ideal candidate should have strong Self-Motivation, Adaptability, Critical Thinking, Creativity skills and be Detail-oriented, Cautious."
5,Content Creator,Creative Arts,Company 5,Africa,Lagos,128410,Manager,Certification,"Sketch, Adobe Creative Suite, Unity","Creativity, Teamwork","Organized, Collaborative, Outgoing",Remote,Startup (1-50),High Growth,2025-03-08,88,616,0.36,"This is a Manager Content Creator position requiring expertise in Sketch, Adobe Creative Suite, Unity. The ideal candidate should have strong Creativity, Teamwork skills and be Organized, Collaborative, Outgoing."
6,Special Education Teacher,Education,Company 6,Asia,Seoul,115288,Senior,Master's Degree,"Online Course Development, Curriculum Development, Assessment, Instructional Design, Classroom Management","Emotional Intelligence, Leadership","Practical, Adaptable",Hybrid,Medium (201-1000),Emerging Field,2025-03-10,218,2180,0.29,"This is a Senior Special Education Teacher position requiring expertise in Online Course Development, Curriculum Development, Assessment, Instructional Design, Classroom Management. The ideal candidate should have strong Emotional Intelligence, Leadership skills and be Practical, Adaptable."
7,Product Manager,Business,Company 7,Asia,Seoul,267809,Executive,Associate's Degree,"SQL, Marketing, Google Analytics, PowerBI","Creativity, Critical Thinking, Self-Motivation","Adaptable, Outgoing",On-site,Medium (201-1000),Emerging Field,2025-03-26,306,1530,0.25,"This is a Executive Product Manager position requiring expertise in SQL, Marketing, Google Analytics, PowerBI. The ideal candidate should have strong Creativity, Critical Thinking, Self-Motivation skills and be Adaptable, Outgoing."
8,Video Editor,Creative Arts,Company 8,South America,Bogota,109372,Mid-level,PhD,"Unreal Engine, Color Theory, Photoshop","Problem Solving, Self-Motivation","Methodical, Analytical, Cautious",Hybrid,Enterprise (10000+),Stable Growth,2025-03-20,458,3664,0.21,"This is a Mid-level Video Editor position requiring expertise in Unreal Engine, Color Theory, Photoshop. The ideal candidate should have strong Problem Solving, Self-Motivation skills and be Methodical, Analytical, Cautious."
9,Graphic Designer,Creative Arts,Company 9,Asia,Shanghai,146570,Manager,High School,"Photoshop, Unreal Engine, 3D Modeling, Color Theory","Adaptability, Attention to Detail","Organized, Risk-taker, Visionary",Hybrid,Startup (1-50),Moderate Growth,2025-03-13,103,1133,0.11,"This is a Manager Graphic Designer position requiring expertise in Photoshop, Unreal Engine, 3D Modeling, Color Theory. The ideal candidate should have strong Adaptability, Attention to Detail skills and be Organized, Risk-taker, Visionary."
10,Project Manager,Business,Company 10,South America,Lima,222692,Director,Certification,"Business Intelligence, Tableau, Marketing","Attention to Detail, Communication, Time Management","Innovative, Collaborative, Task-oriented",On-site,Startup (1-50),Stable Growth,2025-03-27,16,80,0.28,"This is a Director Project Manager position requiring expertise in Business Intelligence, Tableau, Marketing. The ideal candidate should have strong Attention to Detail, Communication, Time Management skills and be Innovative, Collaborative, Task-oriented."
11,Materials Scientist,Science & Research,Company 11,Africa,Nairobi,208623,Director,Bachelor's Degree,"Experimental Design, R, Scientific Writing","Attention to Detail, Conflict Resolution","Analytical, Methodical",Flexible,Medium (201-1000),Emerging Field,2025-03-25,491,7365,0.35,"This is a Director Materials Scientist position requiring expertise in Experimental Design, R, Scientific Writing. The ideal candidate should have strong Attention to Detail, Conflict Resolution skills and be Analytical, Methodical."
12,Physicist,Science & Research,Company 12,Africa,Lagos,76995,Entry-level,Associate's Degree,"Scientific Writing, Research Methods, Python","Critical Thinking, Conflict Resolution","Methodical, Innovative",On-site,Small (51-200),High Growth,2025-03-25,311,4043,0.28,"This is a Entry-level Physicist position requiring expertise in Scientific Writing, Research Methods, Python. The ideal candidate should have strong Critical Thinking, Conflict Resolution skills and be Methodical, Innovative."
13,Research Scientist,Science & Research,Company 13,North America,Seattle,58896,Entry-level,High School,"Scientific Instrumentation, Research Methods, Data Analysis, R, Scientific Writing, Python","Interpersonal Skills, Leadership","Organized, Analytical",Flexible,Startup (1-50),Moderate Growth,2025-03-31,89,623,0.36,"This is a Entry-level Research Scientist position requiring expertise in Scientific Instrumentation, Research Methods, Data Analysis, R, Scientific Writing, Python. The ideal candidate should have strong Interpersonal Skills, Leadership skills and be Organized, Analytical."
14,Content Creator,Creative Arts,Company 14,North America,Seattle,203213,Director,Bachelor's Degree,"Photoshop, After Effects, Sketch, Unreal Engine","Critical Thinking, Leadership, Work Ethic","Collaborative, Independent",Flexible,Large (1000+),High Growth,2025-03-09,130,1690,0.25,"This is a Director Content Creator position requiring expertise in Photoshop, After Effects, Sketch, Unreal Engine. The ideal candidate should have strong Critical Thinking, Leadership, Work Ethic skills and be Collaborative, Independent."
15,Mobile Developer,Technology,Company 15,Africa,Cairo,193319,Director,Associate's Degree,"CI/CD, Kubernetes, Machine Learning, JavaScript, React, Java","Work Ethic, Time Management, Self-Motivation","Creative, Outgoing",Flexible,Large (1000+),Slow Growth,2025-03-27,371,2226,0.34,"This is a Director Mobile Developer position requiring expertise in CI/CD, Kubernetes, Machine Learning, JavaScript, React, Java. The ideal candidate should have strong Work Ethic, Time Management, Self-Motivation skills and be Creative, Outgoing."
16,Business Analyst,Business,Company 16,Africa,Cape Town,135481,Manager,PhD,"Microsoft Excel, CRM Software, Business Intelligence, PowerBI, Google Analytics","Creativity, Time Management","Creative, Innovative",Flexible,Enterprise (10000+),Emerging Field,2025-03-22,447,4023,0.05,"This is a Manager Business Analyst position requiring expertise in Microsoft Excel, CRM Software, Business Intelligence, PowerBI, Google Analytics. The ideal candidate should have strong Creativity, Time Management skills and be Creative, Innovative."
17,Pharmacist,Healthcare,Company 17,Asia,Bangalore,188039,Manager,Master's Degree,"Medical Software, Clinical Assessment, Biology, Medical Terminology, Patient Care","Creativity, Interpersonal Skills, Problem Solving, Communication","Analytical, Cautious",Flexible,Enterprise (10000+),Slow Growth,2025-04-02,396,5148,0.23,"This is a Manager Pharmacist position requiring expertise in Medical Software, Clinical Assessment, Biology, Medical Terminology, Patient Care. The ideal candidate should have strong Creativity, Interpersonal Skills, Problem Solving, Communication skills and be Analytical, Cautious."
18,Mobile Developer,Technology,Company 18,Asia,Bangalore,335539,Executive,Bachelor's Degree,"CI/CD, C++, Kubernetes","Teamwork, Creativity, Conflict Resolution","Practical, Methodical, People-oriented",Hybrid,Medium (201-1000),Slow Growth,2025-03-28,235,3525,0.15,"This is a Executive Mobile Developer position requiring expertise in CI/CD, C++, Kubernetes. The ideal candidate should have strong Teamwork, Creativity, Conflict Resolution skills and be Practical, Methodical, People-oriented."
19,Academic Advisor,Education,Company 19,Africa,Nairobi,48037,Entry-level,Bachelor's Degree,"Learning Management Systems, Curriculum Development, Educational Technology, Assessment","Leadership, Emotional Intelligence","Collaborative, Cautious",Hybrid,Small (51-200),Stable Growth,2025-03-31,345,3795,0.12,"This is a Entry-level Academic Advisor position requiring expertise in Learning Management Systems, Curriculum Development, Educational Technology, Assessment. The ideal candidate should have strong Leadership, Emotional Intelligence skills and be Collaborative, Cautious."
20,Animator,Creative Arts,Company 20,Asia,Shanghai,137768,Senior,Master's Degree,"Color Theory, After Effects, Photoshop, 3D Modeling, Sketch","Time Management, Critical Thinking","Visionary, Collaborative",Flexible,Small (51-200),Moderate Growth,2025-03-18,310,2790,0.14,"This is a Senior Animator position requiring expertise in Color Theory, After Effects, Photoshop, 3D Modeling, Sketch. The ideal candidate should have strong Time Management, Critical Thinking skills and be Visionary, Collaborative."
21,Pharmacist,Healthcare,Company 21,Asia,Bangalore,65943,Entry-level,Bachelor's Degree,"Medical Terminology, Biology, Chemistry","Communication, Negotiation","Creative, Task-oriented",Hybrid,Enterprise (10000+),Emerging Field,2025-03-11,300,2700,0.24,"This is a Entry-level Pharmacist position requiring expertise in Medical Terminology, Biology, Chemistry. The ideal candidate should have strong Communication, Negotiation skills and be Creative, Task-oriented."
22,Academic Advisor,Education,Company 22,Africa,Johannesburg,136744,Senior,High School,"Learning Management Systems, Educational Technology, Online Course Development, Instructional Design, Classroom Management","Adaptability, Attention to Detail, Creativity, Critical Thinking","Adaptable, People-oriented",Flexible,Small (51-200),Emerging Field,2025-03-25,18,144,0.31,"This is a Senior Academic Advisor position requiring expertise in Learning Management Systems, Educational Technology, Online Course Development, Instructional Design, Classroom Management. The ideal candidate should have strong Adaptability, Attention to Detail, Creativity, Critical Thinking skills and be Adaptable, People-oriented."
23,Registered Nurse,Healthcare,Company 23,Europe,Dublin,62787,Entry-level,Bachelor's Degree,"Clinical Assessment, Medical Software, Chemistry, Patient Care","Time Management, Creativity, Negotiation","Detail-oriented, Adaptable",On-site,Enterprise (10000+),Stable Growth,2025-03-18,273,1911,0.12,"This is a Entry-level Registered Nurse position requiring expertise in Clinical Assessment, Medical Software, Chemistry, Patient Care. The ideal candidate should have strong Time Management, Creativity, Negotiation skills and be Detail-oriented, Adaptable."
24,Video Editor,Creative Arts,Company 24,Africa,Cairo,74760,Entry-level,Master's Degree,"Illustrator, Adobe Creative Suite, Color Theory","Self-Motivation, Teamwork, Time Management","Creative, Analytical",Flexible,Small (51-200),Moderate Growth,2025-03-24,441,3087,0.3,"This is a Entry-level Video Editor position requiring expertise in Illustrator, Adobe Creative Suite, Color Theory. The ideal candidate should have strong Self-Motivation, Teamwork, Time Management skills and be Creative, Analytical."
25,Pharmacist,Healthcare,Company 25,South America,Bogota,137441,Senior,Associate's Degree,"Electronic Health Records, Biology, Medical Software, Clinical Assessment, Healthcare Regulations, Patient Care","Conflict Resolution, Teamwork, Communication, Adaptability","Innovative, Adaptable, Independent",Flexible,Medium (201-1000),Moderate Growth,2025-03-27,225,1125,0.12,"This is a Senior Pharmacist position requiring expertise in Electronic Health Records, Biology, Medical Software, Clinical Assessment, Healthcare Regulations, Patient Care. The ideal candidate should have strong Conflict Resolution, Teamwork, Communication, Adaptability skills and be Innovative, Adaptable, Independent."
26,Cloud Architect,Technology,Company 26,Asia,Singapore,161336,Manager,Master's Degree,"C++, TensorFlow, CI/CD, AWS, Kubernetes","Leadership, Time Management","Independent, Adaptable, Methodical",Remote,Enterprise (10000+),Moderate Growth,2025-03-28,127,1524,0.06,"This is a Manager Cloud Architect position requiring expertise in C++, TensorFlow, CI/CD, AWS, Kubernetes. The ideal candidate should have strong Leadership, Time Management skills and be Independent, Adaptable, Methodical."
27,Human Resources Manager,Business,Company 27,Africa,Nairobi,231916,Director,PhD,"PowerBI, Google Analytics, Financial Modeling, Budgeting, Marketing","Time Management, Attention to Detail","Risk-taker, Detail-oriented, Outgoing",Hybrid,Large (1000+),Slow Growth,2025-03-15,266,1330,0.27,"This is a Director Human Resources Manager position requiring expertise in PowerBI, Google Analytics, Financial Modeling, Budgeting, Marketing. The ideal candidate should have strong Time Management, Attention to Detail skills and be Risk-taker, Detail-oriented, Outgoing."
28,Business Analyst,Business,Company 28,Africa,Lagos,145683,Manager,Master's Degree,"Project Management, Microsoft Excel, CRM Software, Marketing, Google Analytics","Problem Solving, Self-Motivation, Emotional Intelligence, Communication","People-oriented, Practical",On-site,Startup (1-50),Moderate Growth,2025-03-16,21,168,0.39,"This is a Manager Business Analyst position requiring expertise in Project Management, Microsoft Excel, CRM Software, Marketing, Google Analytics. The ideal candidate should have strong Problem Solving, Self-Motivation, Emotional Intelligence, Communication skills and be People-oriented, Practical."
29,DevOps Engineer,Technology,Company 29,Australia,Sydney,115090,Mid-level,PhD,"PyTorch, C++, Machine Learning, JavaScript","Teamwork, Emotional Intelligence","Analytical, Organized",Remote,Startup (1-50),Moderate Growth,2025-03-23,83,581,0.1,"This is a Mid-level DevOps Engineer position requiring expertise in PyTorch, C++, Machine Learning, JavaScript. The ideal candidate should have strong Teamwork, Emotional Intelligence skills and be Analytical, Organized."
30,Cloud Architect,Technology,Company 30,North America,Seattle,135632,Senior,Certification,"Cloud Computing, Docker, React","Creativity, Negotiation, Emotional Intelligence, Adaptability","Practical, Detail-oriented",Hybrid,Startup (1-50),Stable Growth,2025-03-21,232,2320,0.15,"This is a Senior Cloud Architect position requiring expertise in Cloud Computing, Docker, React. The ideal candidate should have strong Creativity, Negotiation, Emotional Intelligence, Adaptability skills and be Practical, Detail-oriented."
31,Laboratory Technician,Science & Research,Company 31,South America,Bogota,44945,Entry-level,Certification,"Laboratory Techniques, Python, Data Analysis, Scientific Writing, MATLAB, R","Negotiation, Interpersonal Skills, Self-Motivation, Teamwork","Detail-oriented, Adaptable, People-oriented",Remote,Medium (201-1000),Stable Growth,2025-03-21,201,1206,0.25,"This is a Entry-level Laboratory Technician position requiring expertise in Laboratory Techniques, Python, Data Analysis, Scientific Writing, MATLAB, R. The ideal candidate should have strong Negotiation, Interpersonal Skills, Self-Motivation, Teamwork skills and be Detail-oriented, Adaptable, People-oriented."
32,Animator,Creative Arts,Company 32,Australia,Melbourne,142472,Manager,Master's Degree,"Unreal Engine, UI/UX, Illustrator, Adobe Creative Suite","Communication, Conflict Resolution","Independent, Task-oriented",On-site,Small (51-200),Slow Growth,2025-03-21,26,260,0.23,"This is a Manager Animator position requiring expertise in Unreal Engine, UI/UX, Illustrator, Adobe Creative Suite. The ideal candidate should have strong Communication, Conflict Resolution skills and be Independent, Task-oriented."
33,Healthcare Administrator,Healthcare,Company 33,Africa,Johannesburg,161228,Manager,Associate's Degree,"Laboratory Techniques, Medical Software, Electronic Health Records, Clinical Assessment","Interpersonal Skills, Leadership, Work Ethic, Critical Thinking","Practical, Task-oriented, Collaborative",Remote,Startup (1-50),Slow Growth,2025-03-23,184,2024,0.23,"This is a Manager Healthcare Administrator position requiring expertise in Laboratory Techniques, Medical Software, Electronic Health Records, Clinical Assessment. The ideal candidate should have strong Interpersonal Skills, Leadership, Work Ethic, Critical Thinking skills and be Practical, Task-oriented, Collaborative."
34,Financial Analyst,Business,Company 34,South America,Buenos Aires,101701,Senior,Certification,"CRM Software, Microsoft Excel, Google Analytics, Marketing, Financial Modeling","Communication, Problem Solving, Interpersonal Skills","Creative, Innovative, Organized",Remote,Medium (201-1000),Moderate Growth,2025-03-14,204,1632,0.27,"This is a Senior Financial Analyst position requiring expertise in CRM Software, Microsoft Excel, Google Analytics, Marketing, Financial Modeling. The ideal candidate should have strong Communication, Problem Solving, Interpersonal Skills skills and be Creative, Innovative, Organized."
35,School Counselor,Education,Company 35,Europe,Madrid,109344,Senior,Master's Degree,"Assessment, Learning Management Systems, Online Course Development, Educational Technology","Attention to Detail, Negotiation","Cautious, Creative, Analytical",On-site,Startup (1-50),Moderate Growth,2025-03-17,176,2464,0.22,"This is a Senior School Counselor position requiring expertise in Assessment, Learning Management Systems, Online Course Development, Educational Technology. The ideal candidate should have strong Attention to Detail, Negotiation skills and be Cautious, Creative, Analytical."
36,Laboratory Technician,Science & Research,Company 36,South America,Santiago,149854,Senior,Certification,"Laboratory Techniques, Data Analysis, Experimental Design, Research Methods, MATLAB, Statistical Analysis","Conflict Resolution, Interpersonal Skills, Communication, Self-Motivation","Adaptable, Collaborative",Remote,Large (1000+),Moderate Growth,2025-03-25,114,798,0.37,"This is a Senior Laboratory Technician position requiring expertise in Laboratory Techniques, Data Analysis, Experimental Design, Research Methods, MATLAB, Statistical Analysis. The ideal candidate should have strong Conflict Resolution, Interpersonal Skills, Communication, Self-Motivation skills and be Adaptable, Collaborative."
37,Graphic Designer,Creative Arts,Company 37,North America,Chicago,117289,Senior,Bachelor's Degree,"Illustrator, UI/UX, Photoshop, Adobe Creative Suite, Unreal Engine, Unity","Conflict Resolution, Adaptability","Methodical, People-oriented",Flexible,Medium (201-1000),Moderate Growth,2025-03-21,232,2088,0.11,"This is a Senior Graphic Designer position requiring expertise in Illustrator, UI/UX, Photoshop, Adobe Creative Suite, Unreal Engine, Unity. The ideal candidate should have strong Conflict Resolution, Adaptability skills and be Methodical, People-oriented."
38,Physician,Healthcare,Company 38,Australia,Sydney,187731,Director,PhD,"Laboratory Techniques, Clinical Assessment, Medical Terminology, Electronic Health Records","Teamwork, Work Ethic, Time Management","Outgoing, Analytical, Creative",Remote,Medium (201-1000),Emerging Field,2025-03-06,314,3140,0.39,"This is a Director Physician position requiring expertise in Laboratory Techniques, Clinical Assessment, Medical Terminology, Electronic Health Records. The ideal candidate should have strong Teamwork, Work Ethic, Time Management skills and be Outgoing, Analytical, Creative."
39,Education Technology Specialist,Education,Company 39,Africa,Lagos,256985,Executive,Associate's Degree,"Online Course Development, Learning Management Systems, Assessment","Critical Thinking, Self-Motivation, Adaptability","Visionary, Analytical, Collaborative",Flexible,Enterprise (10000+),Emerging Field,2025-03-22,345,2760,0.21,"This is a Executive Education Technology Specialist position requiring expertise in Online Course Development, Learning Management Systems, Assessment. The ideal candidate should have strong Critical Thinking, Self-Motivation, Adaptability skills and be Visionary, Analytical, Collaborative."
40,Marketing Manager,Business,Company 40,North America,Austin,257321,Executive,Master's Degree,"Google Analytics, Tableau, CRM Software","Teamwork, Creativity, Conflict Resolution","Risk-taker, Methodical",Remote,Large (1000+),Emerging Field,2025-03-23,155,2170,0.27,"This is a Executive Marketing Manager position requiring expertise in Google Analytics, Tableau, CRM Software. The ideal candidate should have strong Teamwork, Creativity, Conflict Resolution skills and be Risk-taker, Methodical."
41,Pharmacist,Healthcare,Company 41,Africa,Cape Town,337287,Executive,Bachelor's Degree,"Healthcare Regulations, Laboratory Techniques, Clinical Assessment, Electronic Health Records","Attention to Detail, Work Ethic","Detail-oriented, Creative, Analytical",Remote,Large (1000+),Stable Growth,2025-03-15,248,1984,0.16,"This is a Executive Pharmacist position requiring expertise in Healthcare Regulations, Laboratory Techniques, Clinical Assessment, Electronic Health Records. The ideal candidate should have strong Attention to Detail, Work Ethic skills and be Detail-oriented, Creative, Analytical."
42,UI/UX Designer,Technology,Company 42,Asia,Dubai,163050,Director,Certification,"Java, Machine Learning, Git","Interpersonal Skills, Critical Thinking, Creativity","Methodical, Organized, Adaptable",Hybrid,Medium (201-1000),High Growth,2025-03-09,40,320,0.16,"This is a Director UI/UX Designer position requiring expertise in Java, Machine Learning, Git. The ideal candidate should have strong Interpersonal Skills, Critical Thinking, Creativity skills and be Methodical, Organized, Adaptable."
43,Audio Engineer,Creative Arts,Company 43,North America,San Francisco,275206,Executive,Master's Degree,"After Effects, Blender, Unity, Illustrator, Adobe Creative Suite, Typography","Negotiation, Teamwork, Attention to Detail, Adaptability","Cautious, Outgoing, Methodical",Hybrid,Enterprise (10000+),Slow Growth,2025-03-14,285,1995,0.17,"This is a Executive Audio Engineer position requiring expertise in After Effects, Blender, Unity, Illustrator, Adobe Creative Suite, Typography. The ideal candidate should have strong Negotiation, Teamwork, Attention to Detail, Adaptability skills and be Cautious, Outgoing, Methodical."
44,Physician,Healthcare,Company 44,Asia,Tokyo,119411,Senior,Bachelor's Degree,"Chemistry, Laboratory Techniques, Healthcare Regulations, Medical Software","Negotiation, Conflict Resolution","Outgoing, People-oriented",On-site,Small (51-200),Emerging Field,2025-03-07,112,1008,0.15,"This is a Senior Physician position requiring expertise in Chemistry, Laboratory Techniques, Healthcare Regulations, Medical Software. The ideal candidate should have strong Negotiation, Conflict Resolution skills and be Outgoing, People-oriented."
45,Cybersecurity Analyst,Technology,Company 45,South America,Sao Paulo,120923,Senior,Bachelor's Degree,"Git, CI/CD, Kubernetes, Cloud Computing, Machine Learning","Self-Motivation, Teamwork, Time Management, Negotiation","People-oriented, Practical",Remote,Large (1000+),Stable Growth,2025-03-15,242,2662,0.23,"This is a Senior Cybersecurity Analyst position requiring expertise in Git, CI/CD, Kubernetes, Cloud Computing, Machine Learning. The ideal candidate should have strong Self-Motivation, Teamwork, Time Management, Negotiation skills and be People-oriented, Practical."
